"宇宙人ミノリス??????","Cosmosmino222","@Cosmosmino222","宇宙人ミノリス?????? @Cosmosmino222 宇宙人です。フォローしていただくことで、鋭い頭脳と自信のエネルギーをお送りいたします。 【総督→ @cosmos_alcor 】","自分の人生を変えることに遠慮はいらない。自分の人生も自分のゴールも自分自身が最後まで守る。それが自分軸の人生をおくるということ。","755 ","15","0","0"
"宇宙人ザウラク??????","CosmosZaurak842","@CosmosZaurak842","宇宙人ザウラク?????? @CosmosZaurak842 宇宙人です。フォローしていただくことで、ドラマティックな運命のエネルギーを提供いたします。 【総督→ @cosmos_alcor 】","【特殊エネルギー】 1億円プレイヤーを輩出するヒーリング。 1千万プレイヤーはごろごろいます。  アセンデッドマスター サンジェルマン 変容、具現化の支援、財政的支援  価格：5万円⇒トライアル限定無償 応募期限：本日中 応募方法：リツイート＆フォローでDMまで【サンジェルマン】","753 ","25","0","0"
"宇宙人ラサラス?????","CosmosRasalas","@CosmosRasalas","宇宙人ラサラス????? @CosmosRasalas 宇宙人です。フォローしていただくことで、夢と恋と成功のエネルギーを提供いたします。 【総督→ @cosmos_alcor 】","何かに興味があるとき、あなたはそれを即座にやってのけます。その時、即時の理解と変換が生まれるのです。あなたが今変わらなければ、将来も決して変わることはありません。この変換は即時に行われます。革命は今であって、明日ではありません。","1735 ","31","4","0"
"宇宙人ナシュ???????","CosmosMajor397","@CosmosMajor397","宇宙人ナシュ??????? @CosmosMajor397 宇宙人です。フォローしていただくことで、負けず嫌いの向上心のエネルギーをお送りいたします。 【総督→ @cosmos_alcor 】","他人と競争してはいけない  ビジネスの基本は、自分の得意分野かつ競合が少ない分野で勝負することです  例えばウェブ検索のSEO SEOでは自社の検索順位を同業他社のそれより上げるため多くの会社がコストをかけています しかし敵が少なければそんな事する必要はないのです","767 ","28","3","1"
"宇宙人グラフィアス???????","CosmosGraffias","@CosmosGraffias","宇宙人グラフィアス??????? @CosmosGraffias 宇宙人です。フォローしていただくことで、野心を秘めた穏やかさのエネルギーをお送りいたします。 【総督→ @cosmos_alcor 】","私たちの行為は観念によって形作られています。そして私たちの全見解は観念によって条件付けられています。したがって、観念が私たちの関係を形作るのです。その観念によって関係を形作ることは、関係の理解を妨げます。","713 ","18","0","0"
"氣力の増幅／ソウルメイトやスピッリットとの繋がりを思い出す ・直観、感性の向上","SoulmatSpirit03","@SoulmatSpirit03","氣力の増幅／ソウルメイトやスピッリットとの繋がりを思い出す ・直観、感性の向上 @SoulmatSpirit03 ニューアトランティス時代の赤道は、ブラジルを通っており、日本と全く逆の電磁波エネルギーを備えた、エネルギーを幾つも、開発しました。 その中でも、特別、不安定感を消し、 良からぬ霊的な一切の存在を、完全にブロック／安定させるモノが、 ここでお伝えしているニューバージョンの特殊エネルギーです。","■『人生の目標が無いことが最大の問題』 目標に向かって進んでいれば、他のことに目が向かない。 ネガティブな感情や不安心配、良からぬ人間関係に捉われない。  ほとんどの人は、人生の目標が無いから、 おかしなことに目が向き悩む。 人生の目標を見つけて突き進めば、悩まなくなる。","745 ","12","0","0"
"宇宙人サダクビア??????","CosmosSadaku64","@CosmosSadaku64","宇宙人サダクビア?????? @CosmosSadaku64 宇宙人です。フォローしていただくことで、ひきこもりがちな夢想のエネルギーをお送りいたします。 【総督→ @cosmos_alcor 】","「止観明静」「一念三千」を実現する 密教場の周波数があります。  第一弾は788万字の転生教則を、 非言語の情報場に圧縮したエッセンシャルエネルギー。  参加方法： ・無料ヒーリングはリツイート後30分間 ・プレミアムヒーリングはDMまで【＠一念】","699 ","10","1","0"
"宇宙人エラセド??????","bot63469043","@bot63469043","宇宙人エラセド?????? @bot63469043 宇宙人です。フォローしていただくことで、冒険に挑む正義感のエネルギーをお送りいたします。 【総督→ @cosmos_alcor 】","コーチングですでに成功している方も是非一度、 DMでサポートセンターとお話をする機会を与えてくれますと幸いです。 伸びている方をより伸ばすお手伝いもしております。 またより伸びる形をすでに用意しております。","726 ","7","0","0"
"仙人～フォローでご利益～RTで開運","CosmosProcyon55","アカウントエラー","アカウントエラー","アカウントエラー","アカウントエラー","アカウントエラー","アカウントエラー","アカウントエラー"
"宇宙人アダフェラ???????","CosmosAdhafera5","@CosmosAdhafera5","宇宙人アダフェラ??????? @CosmosAdhafera5 宇宙人です。フォローしていただくことで、頼りにされるプライドのエネルギーをお送りいたします。 【総督→ @cosmos_alcor 】","セルフトークをコントロールしなければ、セルフトークによって自分がコントロールされてしまう。自分の評価を下げるセルフトークを放置すると、本当に自分の能力は低くなって行くと言うこと。無意識でやっているセルフトークをコントロールすることはとても大切なことなのです。","600 ","21","0","0"
"～アンケト(Anuket)～","axVwtEu9","@axVwtEu9","～アンケト(Anuket)～ @axVwtEu9 増水をもたらす、飾り立てたもの。 頭上に羽毛で飾った帽子。 クヌムの娘、もしくはサティスの妹。","本当にやりたいことを 見つけたら、  失敗しても、 周囲に反対されても、 目指し続けることです。  あきらめなければ 叶うというのは 綺麗事ではなく 本当のことです。","672 ","17","1","0"
"絶対開運・?????｜気功・ヒーリングmiku?","miku_heal_77","@miku_heal_77","絶対開運・?????｜気功・ヒーリングmiku @miku_heal_77 スターシード、ライトワーカー、ヒーラー、力を与えるヒーリング 【aiko先生　→ @ai_heal_  】","なにか新しいことをしようとすると、 現状維持が強烈に働いて、無意識がものすごい力でもとに戻そうとします。  このホメオスタシスの力を現状維持の門番というのですが、 現状維持の門番を、騙すように、小さなことから些細なことから始めることがポイントです。","711 ","3","0","0"
"宇宙人サギッタェ??????","Cosmossagit77","@Cosmossagit77","宇宙人サギッタェ?????? @Cosmossagit77 宇宙人です。フォローしていただくことで、自省的な成長する人のエネルギーを提供いたします。 【総督→ @cosmos_alcor 】","出会いは必然です。 私と出会って下さったからには 私とあなたの間には起こるべきことがあるのです。","580 ","100","2","1"
"宇宙人オーラ??????","CosmosAura123","@CosmosAura123","宇宙人オーラ?????? @CosmosAura123 宇宙人です。フォローしていただくことで、後天的なオーラ値を上げます。 【総督→ @cosmos_alcor 】","■『幸せに導くために大切なこと』  ・プラススパイラルに乗せること  ・繋がりからエネルギーを確保させること  ・進むべき方向性を示すこと  ・正しい考え方を伝えること  ・決定権を委ねてもらうこと  ・ルールを設けてルールに従って貰うこと","602 ","1","0","0"
"宇宙人ルクバー??????","cosmoslukbar","@cosmoslukbar","宇宙人ルクバー?????? @cosmoslukbar 宇宙人です。フォローしていただくことで、即実行のスプリンターのエネルギーをお送りいたします。 【総督→ @cosmos_alcor 】","名称：サファイア（青玉-せいぎょく／鋼石-こうぎょく） 言葉：誠実・愛情・慈愛・徳望・不変・高潔・深い海・崇高 備考：9月の誕生石のひとつ  ・フォロー＆リツイートで不老不死10倍エネルギー ・時間を止めて老化を止める方はDMまで【宇宙空間】","612 ","10","0","0"
"宇宙人マタル??????","CosmosMatal","@CosmosMatal","宇宙人マタル?????? @CosmosMatal 宇宙人です。フォローしていただくことで、恋にのめり込む集中力のエネルギーを提供いたします。 【総督→ @cosmos_alcor 】","屋根の手入れをしないと、雨もりするように、心の手入れを怠ると、「憎しみ」「迷い」「欲張り」「おごり高ぶり」といった感情がもれだしてきます。","543 ","4","0","0"
"絶対開運・???｜気功・ヒーリングikumi?","ikumi_heal_","@ikumi_heal_","絶対開運・???｜気功・ヒーリングikumi @ikumi_heal_ スターシード、ライトワーカー、ヒーラー、根本原因を癒すヒーリング 【aiko先生　→ @ai_heal_  】","新しい知識を得て、 物事を新しい視点で 見られるようになれば、  過去の出来事に対する 解釈も変わります。  「過去は変えられない」 と言いますが、 解釈が変われば まったく別の意味を持ちます。","508 ","18","0","0"
"シヴァ神、存在感＆人間力の増強","LordShivaPower","@LordShivaPower","シヴァ神、存在感＆人間力の増強 @LordShivaPower シヴァ神のような巨大な身体を情報空間に作り、圧倒的な自信を手に入れます  自信を付けたい全ての人に  期待できる変化 ・再生 ・サードアイの開眼 ・破壊と創造 ・男性の精力 ・病気の治癒 ・舞踊 ・豊穣 ・修行 ・生命力","以前の自分はプライベートの時間を削り睡眠時間を削ってhave toの仕事をやっていた時期がある。無意識は嘘がつけないので結局最後は体調を崩した。コーチングに出会って完全want toの毎日になった。だから一人でも多くの人にコーチングを届けたい。人生は自由に選択出来る。","480 ","33","0","0"
"宇宙人ダナブ??????","hashtagsjp2","@hashtagsjp2","宇宙人ダナブ?????? @hashtagsjp2 宇宙人です。フォローしていただくことで、正義感強い情熱のエネルギーをお送りいたします。 【総督→ @cosmos_alcor 】","名称：アラゴナイト（霰石-あられいし） 言葉：母性 備考：誕生石とされる月は無し","637 ","21","0","0"
"宇宙人シグマ??????","CosmosShigu922","アカウントエラー","アカウントエラー","アカウントエラー","アカウントエラー","アカウントエラー","アカウントエラー","アカウントエラー"
"宇宙人オリオニス??????","cosmosorionis12","@cosmosorionis12","宇宙人オリオニス?????? @cosmosorionis12 宇宙人です。フォローしていただくことで、独創性と直感力のエネルギーをお送りいたします。 【総督→ @cosmos_alcor 】","行き詰っているときは、 人と話をすると良いです。  行き詰っている内容について 話す必要はありません。  あなた以外との情報の交流が 新しい刺激になって、 見えなかったものが 見えるようになります。","575 ","7","0","0"
"宇宙人サイフ???????","CosmosSaiph153","@CosmosSaiph153","宇宙人サイフ??????? @CosmosSaiph153 宇宙人です。フォローしていただくことで、向上心あふれる理想のエネルギーをお送りいたします。 【総督→ @cosmos_alcor 】","「私」と「他の人」との関係が社会を作っている以上、根本的に「私自身」を変えなければ、社会の本質的機能の変換もありえないのだ。","703 ","10","0","0"
"絶対開運・??｜気功・ヒーリングsuzu?","suzu_heal_","@suzu_heal_","絶対開運・??｜気功・ヒーリングsuzu @suzu_heal_ スターシード、ライトワーカー、ヒーラー、清らかなエネルギーのヒーリング 【aiko先生　→ @ai_heal_  】","名称：インカローズ（菱マンガン鉱-りょうまんがんこう） 言葉：情熱・優しさ・繊細・豊かな感受性 備考：7月の誕生石のひとつ","521 ","67","8","1"
"宇宙人プラム??????","cosmosplum1","@cosmosplum1","宇宙人プラム?????? @cosmosplum1 宇宙人です。フォローしていただくことで、困難に打ち勝つエネルギーをお送りいたします。 【総督→ @cosmos_alcor 】","『一生涯の導き』 繋がった人たちと一生涯お付き合いをすると決めて、 一緒に成長できるように最善の努力をするべき。 一生涯ということがポイントであり、 一生涯でないと無責任なことが出てくる。","776 ","14","1","0"
"金星の賢人～五次元世界である霊界～","aNQD250mVHXx","@aNQD250mVHXx","金星の賢人～五次元世界である霊界～ @aNQD250mVHXx 悪魔は地球外から来た爬虫類型人間でりゅう座を追放されたドラコニアン。 その手下トカゲ座の罪人レプティリアン。 レプティリアンの傀儡ラージノーズグレイたちである。  グレイは琴座にあるアペックス星の人類であったが、大規模な核戦争を勃発させ、膨大な放射能汚染によって永年、地下生活を余儀なくされた。","コーチングを学び始めてから、 収入が増えたでしょうか、減ったでしょうか？  私は、減った方、変わらない方が 多いように思います。  実はコーチングを収益化する難易度は、 とても高く、正しい方法を取らなければ、 時間の浪費ということも多いです。","750 ","10","0","0"
"～ネフェルテム(Nefertum)～","nefertum21a","@nefertum21a","～ネフェルテム(Nefertum)～ @nefertum21a 頭の上にロータスの花を咲かせた男性。","フォローで開運 リツイートで加速","598 ","14","1","0"
"宇宙人セクンドゥス","CosmosSecundus","@CosmosSecundus","宇宙人セクンドゥス @CosmosSecundus 宇宙人です。フォローしていただくことで、未知を見つめる冒険心溢れるエネルギーを提供いたします。","真理に沿って表現すると多くの人に伝わります  映画やアニメなども真理に沿ったものは多くの人に感動や共感を与えます  アーティストと呼ばれる人たちはインスピレーションを大事にして表現しています  真理は実はとても身近にありあなたも無意識で感じているかもしれないですね","665 ","21","0","0"
"宇宙人ダビー??????","CosmosOrions438","@CosmosOrions438","宇宙人ダビー?????? @CosmosOrions438 宇宙人です。フォローしていただくことで、夢を見つめ輝く瞳のエネルギーを提供いたします。 【総督→ @cosmos_alcor 】","生まれ変わりを 信じる信じないに関わらず、 今のあなたの人生は いずれ終わります。  「またあとで」「また今度」 と言っていると あっという間に 終わりは近づいてきます。","929 ","13","1","0"
"チャクラフラッシュ／チャクラ活性化","X7lYc3pW","@X7lYc3pW","チャクラフラッシュ／チャクラ活性化 @X7lYc3pW 今多くの進化した人々が５次元チャクラを取り戻し、上半身にあるクラウン、第三の目、のど、ハート、太陽神経叢チャクラを開くことは容易になったと感じています。","夢を描くだけでなく、 あなたはそれを必ず達成すると 強く確信して下さい。","738 ","36","5","2"
"宇宙人クルサ???????","CosmosCursa172","@CosmosCursa172","宇宙人クルサ??????? @CosmosCursa172 宇宙人です。フォローしていただくことで、格式を重んじる新鮮なセンスのエネルギーを提供いたします。 【総督→ @cosmos_alcor 】","クロックサイクルを上げ、グレーンサイズを最適化するエネルギー 主な効果： ・頭が良くなり悩まなくなった ・常に思考がクリアで集中力が上がった ・別の仕事のアイデアがよく思い浮かぶようになった ・仕事が早くなり昇進した  参加方法： フォロ＆RT DMまで＠並列脳で現状脱出","568 ","12","0","0"
"アトランティス封印解除とトラウマの癒し・能力開発","toprunner5577","@toprunner5577","アトランティス封印解除とトラウマの癒し・能力開発 @toprunner5577 ・宇宙時代の中で体験している数回のアセンション失敗によるトラウマ ・上記の全トラウマの多次元に渡っての癒しと解消（パラレルW、平行宇宙、その他多次元）","なぜ目の前のチャンスを見過ごすのですか？人生を激変させるチャンスを見て見ぬふりをしてごまかしてもいいのですか？本気になってwant toのゴールを設定しゴールを達成したコンフォートゾーンの臨場感を徹底的に高めましょう。自然と勝手にゴールに向かい始めるはずです。","651 ","11","1","0"
"宇宙人ウルサェ???????","CosmosUrsae512","@CosmosUrsae512","宇宙人ウルサェ??????? @CosmosUrsae512 宇宙人です。フォローしていただくことで、さびしがり屋で素直のエネルギーをお送りいたします。 【総督→ @cosmos_alcor 】","抽象度が高い視点を持ことができればビジネスは成功します。  圧倒的な情報空間を観ることができれ 、ビジネスで失敗する方が難しいでしょう。 水は高い所から低い所に流れでくるのと同じ 、ビジネスも抽象度の高い所から、 抽象度 低い所流れいきます。","591 ","14","0","0"
"神氣／全チャクラ活性／特殊エネルギー｜心香 リオ","barbara_twit65","@barbara_twit65","神氣／全チャクラ活性／特殊エネルギー｜心香 リオ @barbara_twit65 定期的に配信していきます。","■『根本的問題』 問題の多くは、 コミュニケーション不足で起こり、 問題のほとんどは コミュニケーションをしっかり取ることで解決される。","377 ","3","0","0"
"宇宙人ボレアリス???????","Cosmosroseli23","アカウントエラー","アカウントエラー","アカウントエラー","アカウントエラー","アカウントエラー","アカウントエラー","アカウントエラー"
"宇宙人プリオル??????","CosmosPrior","@CosmosPrior","宇宙人プリオル?????? @CosmosPrior 宇宙人です。フォローしていただくことで、強引なまでの前進主義のエネルギーをお送りいたします。 【総督→ @cosmos_alcor 】","無意識のうちに 「～でなければならない」 という考えに縛られていませんか？  それを取り払うと もっと大きな可能性が見えてきます。","863 ","33","5","0"
"ケデシュ女神","KedeshGoddess","@KedeshGoddess","ケデシュ女神 @KedeshGoddess 花と蛇を手にしたライオンを背に立つ裸の正面を向いた女性 アジア方面から導入された女神で、その紀元はシリアと考えられる。 「ケデシュ」とはセム語で「神聖」を意味する。 ハトホル、アナト、アスタルテとも関連づけられている。","ひとりひとり DNAが違いますし、 指紋や声紋も違うのですから、  あなたは最初から唯一無二の存在です。 あなたのユニークさを楽しみましょう。","1100 ","35","1","0"
"オヌリス神","OnurisGod279","@OnurisGod279","オヌリス神 @OnurisGod279 ティニス地方の主神。狩猟の神。 聖獣はライオン。","皆さんは  苫米地式コーチングに興味があるのでしょうか？ サポートセンターに興味があるのでしょうか？  いずれにしても、社会に価値を提供した分相応の対価が支払われます。 皆さんの価値をよりストレートに、対価に変えていきたいです。 とても無駄が多く感じるのです。","1307 ","33","1","0"
"宇宙人ヴェガ?????","CosmosVega417","アカウントエラー","アカウントエラー","アカウントエラー","アカウントエラー","アカウントエラー","アカウントエラー","アカウントエラー"
"宇宙人サダルメリク?????","Sadalmelek123","@Sadalmelek123","宇宙人サダルメリク????? @Sadalmelek123 宇宙人です。フォローしていただくことで、過程を楽しむ臨機応変のエネルギーをお送りいたします。 【総督→ @cosmos_alcor 】","コーチングだけでなく、例えば、 斎藤一人さんが大好きな人はいませんか？ 斎藤一人さん好きな方が、斎藤一人さんのように社会に貢献して、 稼げる人材にすることも可能です。  させるのは、サポートセンターがもっている同じ≪特別な理論≫。 希望の方はDMに【1人さん希望】と連絡下さいませ。","2049 ","32","1","0"
"宇宙人アスケラ??????","CosmosAscella","@CosmosAscella","宇宙人アスケラ?????? @CosmosAscella 宇宙人です。フォローしていただくことで、信頼感あふれる正義のエネルギーを提供いたします。 【総督→ @cosmos_alcor 】","安全そうな道ばかり選んでいると 無難な結果しかでません。 思い切って飛び込むことも必要です。","2051 ","18","1","0"
"セクメト女神","smamiled","@smamiled","@SekhmetGoddess @smamiled I am Sekhmet.","Long live the demon he gon come back from the dead .","208 ","-","8","7"
"ウプウワト","Wepwawet741","@Wepwawet741","ウプウワト @Wepwawet741 ［山犬、多くは旗竿の上に描かれる］ 「道を開くもの」の意。 アヌビス神と同じく、死者の神、墓地の守護神。","???特殊ヒーリング ～?（ピンクな思い）～  このツイートにピンクな思いの運気を封入しています。  恋愛に進展がある 華やかなオーラをまとう やさしい気持ちになる  などの効果があります。  リツイート・フォローで効果を発揮します。  ご報告して頂くとさらに運気が高まります。","1993 ","20","1","0"
"宇宙人シェラタン??????","CosmosSheratan2","アカウントエラー","アカウントエラー","アカウントエラー","アカウントエラー","アカウントエラー","アカウントエラー","アカウントエラー"
"宇宙人ベガ?????","CosmosVega","@CosmosVega","宇宙人ベガ????? @CosmosVega 宇宙人です。フォローしていただくことで、心穏やかになるエネルギーをお送りいたします。 【総督→ @cosmos_alcor 】","潜在意識は考えを実現します。あなたが失敗で頭をいっぱいにしていれば、それは潜在意識の法則によって確実に実現してしまうのです。","1938 ","41","1","0"
"宇宙人ゾスマ?????","CosmosZosma","@CosmosZosma","宇宙人ゾスマ????? @CosmosZosma 宇宙人です。フォローしていただくことで、鋭いセンスと直感のエネルギーをお送りいたします。 【総督→ @cosmos_alcor 】","名称：モスコバイト（白雲母-しろうんも） 言葉：健康・活性・癒し・夫婦和合・恋愛成就 備考：「緊張をほぐしてくれる」と言われている","1785 ","38","1","0"
"宇宙人テレスコピィ?????","CosmosTelescopy","アカウントエラー","アカウントエラー","アカウントエラー","アカウントエラー","アカウントエラー","アカウントエラー","アカウントエラー"
"宇宙人アトラス?????","CosmosAtras963","アカウントエラー","アカウントエラー","アカウントエラー","アカウントエラー","アカウントエラー","アカウントエラー","アカウントエラー"
"宇宙人ミュー??????","CosmosMiu978","アカウントエラー","アカウントエラー","アカウントエラー","アカウントエラー","アカウントエラー","アカウントエラー","アカウントエラー"
"宇宙人ヴェーロルム?????","CosmosVelorum","@CosmosVelorum","宇宙人ヴェーロルム????? @CosmosVelorum 宇宙人です。フォローしていただくことで、冷静に判断する野心のエネルギーをお送りいたします。 【総督→ @cosmos_alcor 】","過去や未来というのは 頭の中に作り出している幻想です。  どうせ幻想なら、 囚われるのではなく、 楽しく描きましょう。","1638 ","16","0","0"
