"宇宙人エラセド??????","bot63469043","アカウントエラー","アカウントエラー","アカウントエラー","アカウントエラー","アカウントエラー","アカウントエラー","アカウントエラー"
"仙人～フォローでご利益～RTで開運","CosmosProcyon55","アカウントエラー","アカウントエラー","アカウントエラー","アカウントエラー","アカウントエラー","アカウントエラー","アカウントエラー"
"宇宙人アダフェラ???????","CosmosAdhafera5","@CosmosAdhafera5","宇宙人アダフェラ??????? @CosmosAdhafera5 宇宙人です。フォローしていただくことで、頼りにされるプライドのエネルギーをお送りいたします。 【総督→ @cosmos_alcor 】","「なりたい自分になる」とは 生まれ変わることです。  生まれ変わる覚悟をお持ちなら 【生まれ変わる】と添えてDMを送って下さい。 お手伝い致します。","600 ","10","2","1"
"～アンケト(Anuket)～","axVwtEu9","@axVwtEu9","～アンケト(Anuket)～ @axVwtEu9 増水をもたらす、飾り立てたもの。 頭上に羽毛で飾った帽子。 クヌムの娘、もしくはサティスの妹。","『フォローで厄除け・リツイートで開運』奇跡のアファメーション 波乱のない充実した人生を送れますが、全ては貴方様が地道に努力を続けた賜物でしょう。 フォロワー様を支えれますように。","672 ","15","0","0"
"絶対開運・?????｜気功・ヒーリングmiku?","miku_heal_77","@miku_heal_77","絶対開運・?????｜気功・ヒーリングmiku @miku_heal_77 スターシード、ライトワーカー、ヒーラー、力を与えるヒーリング 【aiko先生　→ @ai_heal_21 】","ヒーリングでは必要に応じて ご自身でお使いいただけるセルフヒーリングの 技術をお渡ししております。","712 ","15","0","0"
"宇宙人サギッタェ??????","Cosmossagit77","アカウントエラー","アカウントエラー","アカウントエラー","アカウントエラー","アカウントエラー","アカウントエラー","アカウントエラー"
"宇宙人オーラ??????","CosmosAura123","@CosmosAura123","宇宙人オーラ?????? @CosmosAura123 宇宙人です。フォローしていただくことで、後天的なオーラ値を上げます。 【総督→ @cosmos_alcor 】","我々が真に孤独になれるのは、問題に直面したら問題を明日にひきのばさないでその場でそれを解決する場合である。それ故、多くの人がいる家の中にあっても、バスに乗っていても、孤独になる事ができるのである。この孤独が常に新しい心、天真爛漫な心を示しているのだ。","602 ","2","0","0"
"宇宙人ルクバー??????","cosmoslukbar","@cosmoslukbar","宇宙人ルクバー?????? @cosmoslukbar 宇宙人です。フォローしていただくことで、即実行のスプリンターのエネルギーをお送りいたします。 【総督→ @cosmos_alcor 】","名称：サファイア（青玉-せいぎょく／鋼石-こうぎょく） 言葉：誠実・愛情・慈愛・徳望・不変・高潔・深い海・崇高 備考：9月の誕生石のひとつ  ・フォロー＆リツイートで不老不死10倍エネルギー ・時間を止めて老化を止める方はDMまで【宇宙空間】","613 ","12","0","0"
"宇宙人マタル??????","CosmosMatal","@CosmosMatal","宇宙人マタル?????? @CosmosMatal 宇宙人です。フォローしていただくことで、恋にのめり込む集中力のエネルギーを提供いたします。 【総督→ @cosmos_alcor 】","屋根の手入れをしないと、雨もりするように、心の手入れを怠ると、「憎しみ」「迷い」「欲張り」「おごり高ぶり」といった感情がもれだしてきます。","544 ","6","0","0"
"絶対開運・???｜気功・ヒーリングikumi?","ikumi_heal_","@ikumi_heal_","絶対開運・???｜気功・ヒーリングikumi @ikumi_heal_ スターシード、ライトワーカー、ヒーラー、根本原因を癒すヒーリング 【aiko先生　→ @ai_heal_  】","やりたいことだけやる、完全want toが脳のパフォーマンスを一気に引き出す。","509 ","1","0","0"
"シヴァ神、存在感＆人間力の増強","LordShivaPower","@LordShivaPower","シヴァ神、存在感＆人間力の増強 @LordShivaPower シヴァ神のような巨大な身体を情報空間に作り、圧倒的な自信を手に入れます  自信を付けたい全ての人に  期待できる変化 ・再生 ・サードアイの開眼 ・破壊と創造 ・男性の精力 ・病気の治癒 ・舞踊 ・豊穣 ・修行 ・生命力","以前の自分はプライベートの時間を削り睡眠時間を削ってhave toの仕事をやっていた時期がある。無意識は嘘がつけないので結局最後は体調を崩した。コーチングに出会って完全want toの毎日になった。だから一人でも多くの人にコーチングを届けたい。人生は自由に選択出来る。","480 ","33","0","0"
"宇宙人ダナブ??????","hashtagsjp2","アカウントエラー","アカウントエラー","アカウントエラー","アカウントエラー","アカウントエラー","アカウントエラー","アカウントエラー"
"宇宙人シグマ??????","CosmosShigu922","アカウントエラー","アカウントエラー","アカウントエラー","アカウントエラー","アカウントエラー","アカウントエラー","アカウントエラー"
"宇宙人オリオニス??????","cosmosorionis12","@cosmosorionis12","宇宙人オリオニス?????? @cosmosorionis12 宇宙人です。フォローしていただくことで、独創性と直感力のエネルギーをお送りいたします。 【総督→ @cosmos_alcor 】","多くの人は嫌いなものを排除しようとします  しかし何かを否定する時はその人の潜在意識は 実は自分の中の嫌な部分を排除しようとしています 否定し続ける限り 人生は納得出来ない出来事が起きます  排除したい出来事を認めた瞬間に 人生から苦しみや苛立ちは消えていきますよ","578 ","2","0","0"
"宇宙人サイフ???????","CosmosSaiph153","@CosmosSaiph153","宇宙人サイフ??????? @CosmosSaiph153 宇宙人です。フォローしていただくことで、向上心あふれる理想のエネルギーをお送りいたします。 【総督→ @cosmos_alcor 】","もちろん、 あなた自身の欲求を 満たすことは 問題ないのですが、  それを乗り越えたところでしか 見えない世界があります。  そこにぜひ向かって欲しいと 思っています。","704 ","3","0","0"
"絶対開運・??｜気功・ヒーリングsuzu?","suzu_heal_","@suzu_heal_","絶対開運・??｜気功・ヒーリングsuzu @suzu_heal_ スターシード、ライトワーカー、ヒーラー、清らかなエネルギーのヒーリング 【aiko先生　→ @ai_heal_  】","名称：インカローズ（菱マンガン鉱-りょうまんがんこう） 言葉：情熱・優しさ・繊細・豊かな感受性 備考：7月の誕生石のひとつ","521 ","75","8","1"
"宇宙人プラム??????","cosmosplum1","@cosmosplum1","宇宙人プラム?????? @cosmosplum1 宇宙人です。フォローしていただくことで、困難に打ち勝つエネルギーをお送りいたします。 【総督→ @cosmos_alcor 】","あなたはソウルメイトの存在を信じますか 人間的成長のレベルによりどんなソウルメイトと出会うかが決まります 昔の恋人と似たような人とまた付き合い困る人は自分が成長すると変わります 自身を心から愛する事があなたがより良いソウルメイトと出会い幸せな関係性を持つ秘訣です","776 ","5","0","0"
"金星の賢人～五次元世界である霊界～","aNQD250mVHXx","アカウントエラー","アカウントエラー","アカウントエラー","アカウントエラー","アカウントエラー","アカウントエラー","アカウントエラー"
"～ネフェルテム(Nefertum)～","nefertum21a","アカウントエラー","アカウントエラー","アカウントエラー","アカウントエラー","アカウントエラー","アカウントエラー","アカウントエラー"
"宇宙人セクンドゥス","CosmosSecundus","@CosmosSecundus","宇宙人セクンドゥス @CosmosSecundus 宇宙人です。フォローしていただくことで、未知を見つめる冒険心溢れるエネルギーを提供いたします。","名称：インカローズ（菱マンガン鉱-りょうまんがんこう） 言葉：情熱・優しさ・繊細・豊かな感受性 備考：情熱の石（パッションローズ）という別名をもつ","665 ","6","0","0"
"宇宙人ダビー??????","CosmosOrions438","@CosmosOrions438","宇宙人ダビー?????? @CosmosOrions438 宇宙人です。フォローしていただくことで、夢を見つめ輝く瞳のエネルギーを提供いたします。 【総督→ @cosmos_alcor 】","空気を読みすぎてはいけない。  空気を読んで他人に合わせて行動し過ぎると、自分の思いを伝える能力がなくなってしまう。  大切な友人、恋人や家族に貴女の思いを伝えることができなくなったらどうなるだろうか？空気を読むことで失うものがあることを覚えておいて欲しい。","929 ","1","0","0"
"チャクラフラッシュ／チャクラ活性化","X7lYc3pW","@X7lYc3pW","チャクラフラッシュ／チャクラ活性化 @X7lYc3pW 今多くの進化した人々が５次元チャクラを取り戻し、上半身にあるクラウン、第三の目、のど、ハート、太陽神経叢チャクラを開くことは容易になったと感じています。","名称：ホワイトコーラル（白珊瑚-しろさんご） 言葉：幸福・長寿、知恵 備考：3月の誕生石のひとつ","738 ","5","0","0"
"宇宙人クルサ???????","CosmosCursa172","アカウントエラー","アカウントエラー","アカウントエラー","アカウントエラー","アカウントエラー","アカウントエラー","アカウントエラー"
"アトランティス封印解除とトラウマの癒し・能力開発","toprunner5577","@toprunner5577","アトランティス封印解除とトラウマの癒し・能力開発 @toprunner5577 ・宇宙時代の中で体験している数回のアセンション失敗によるトラウマ ・上記の全トラウマの多次元に渡っての癒しと解消（パラレルW、平行宇宙、その他多次元）","愛されたい、と思っているなら まず愛することから始めると良いです。  「愛する」とは どういうことなのかが 分かっていないと、  自分が愛されているのかどうかも 分かりません。","654 ","10","1","0"
"宇宙人ウルサェ???????","CosmosUrsae512","@CosmosUrsae512","宇宙人ウルサェ??????? @CosmosUrsae512 宇宙人です。フォローしていただくことで、さびしがり屋で素直のエネルギーをお送りいたします。 【総督→ @cosmos_alcor 】","人生で迷うことはありますか？  迷いをなくすと人生はスムーズに思うように進んでいきます やりたいことがあるのならやりましょう ハートのトキメキを信じ ワクワクを信じ 正しさよりも楽しさで選択しましょう  喜びで生きると奇跡は沢山起きます 今日も一日楽しんで下さいね","591 ","25","3","0"
"神氣／全チャクラ活性／特殊エネルギー｜心香 リオ","barbara_twit65","アカウントエラー","アカウントエラー","アカウントエラー","アカウントエラー","アカウントエラー","アカウントエラー","アカウントエラー"
"宇宙人ボレアリス???????","Cosmosroseli23","アカウントエラー","アカウントエラー","アカウントエラー","アカウントエラー","アカウントエラー","アカウントエラー","アカウントエラー"
"宇宙人プリオル??????","CosmosPrior","@CosmosPrior","宇宙人プリオル?????? @CosmosPrior 宇宙人です。フォローしていただくことで、強引なまでの前進主義のエネルギーをお送りいたします。 【総督→ @cosmos_alcor 】","無意識のうちに 「～でなければならない」 という考えに縛られていませんか？  それを取り払うと もっと大きな可能性が見えてきます。","863 ","48","7","0"
"ケデシュ女神","KedeshGoddess","@KedeshGoddess","ケデシュ女神 @KedeshGoddess 花と蛇を手にしたライオンを背に立つ裸の正面を向いた女性 アジア方面から導入された女神で、その紀元はシリアと考えられる。 「ケデシュ」とはセム語で「神聖」を意味する。 ハトホル、アナト、アスタルテとも関連づけられている。","名称：ジェムシリカ（珪孔雀石-けいくじゃくせき） 言葉：女性・安産・愛 備考：11月の誕生石のひとつ  ・フォロー＆リツイートで出産力10倍 ・すぐに子宝に恵まれる方はDMまで【ベビ力】","1100 ","4","0","0"
"オヌリス神","OnurisGod279","アカウントエラー","アカウントエラー","アカウントエラー","アカウントエラー","アカウントエラー","アカウントエラー","アカウントエラー"
"宇宙人ヴェガ?????","CosmosVega417","アカウントエラー","アカウントエラー","アカウントエラー","アカウントエラー","アカウントエラー","アカウントエラー","アカウントエラー"
"宇宙人サダルメリク?????","Sadalmelek123","アカウントエラー","アカウントエラー","アカウントエラー","アカウントエラー","アカウントエラー","アカウントエラー","アカウントエラー"
"宇宙人アスケラ??????","CosmosAscella","@CosmosAscella","宇宙人アスケラ?????? @CosmosAscella 宇宙人です。フォローしていただくことで、信頼感あふれる正義のエネルギーを提供いたします。 【総督→ @cosmos_alcor 】","安全そうな道ばかり選んでいると 無難な結果しかでません。 思い切って飛び込むことも必要です。","2051 ","20","2","0"
"セクメト女神","smamiled","@smamiled","@SekhmetGoddess @smamiled I am Sekhmet.","Long live the demon he gon come back from the dead .","208 ","-","8","7"
"ウプウワト","Wepwawet741","@Wepwawet741","ウプウワト @Wepwawet741 ［山犬、多くは旗竿の上に描かれる］ 「道を開くもの」の意。 アヌビス神と同じく、死者の神、墓地の守護神。","人の心に苦しみが生じるにあたっては、必ずその原因が存在します。この原因について正しく理解しないために、いつまでも苦しみに縛り付けられているのです。","1994 ","10","0","0"
"宇宙人シェラタン??????","CosmosSheratan2","アカウントエラー","アカウントエラー","アカウントエラー","アカウントエラー","アカウントエラー","アカウントエラー","アカウントエラー"
"宇宙人ベガ?????","CosmosVega","@CosmosVega","宇宙人ベガ????? @CosmosVega 宇宙人です。フォローしていただくことで、心穏やかになるエネルギーをお送りいたします。 【総督→ @cosmos_alcor 】","名称：ヒデナイト（リチア輝石-りちあきせき） 言葉：清々しさ・自然の恵み 備考：4月の誕生石のひとつ  ・フォロー＆リツイートで本来のパワー10倍回復 ・さらにヒーリングさせたい方はDMまで【伝授】","1938 ","25","1","0"
"宇宙人ゾスマ?????","CosmosZosma","@CosmosZosma","宇宙人ゾスマ????? @CosmosZosma 宇宙人です。フォローしていただくことで、鋭いセンスと直感のエネルギーをお送りいたします。 【総督→ @cosmos_alcor 】","ヒーリングは心の技術です。 心が強くヒーリングに向かっているほど 効果が強くなります。","1787 ","11","0","0"
"宇宙人テレスコピィ?????","CosmosTelescopy","アカウントエラー","アカウントエラー","アカウントエラー","アカウントエラー","アカウントエラー","アカウントエラー","アカウントエラー"
"宇宙人アトラス?????","CosmosAtras963","アカウントエラー","アカウントエラー","アカウントエラー","アカウントエラー","アカウントエラー","アカウントエラー","アカウントエラー"
"宇宙人ミュー??????","CosmosMiu978","アカウントエラー","アカウントエラー","アカウントエラー","アカウントエラー","アカウントエラー","アカウントエラー","アカウントエラー"
"宇宙人ヴェーロルム?????","CosmosVelorum","@CosmosVelorum","宇宙人ヴェーロルム????? @CosmosVelorum 宇宙人です。フォローしていただくことで、冷静に判断する野心のエネルギーをお送りいたします。 【総督→ @cosmos_alcor 】","名称：ブルーアンバー（青色琥珀-せいしょくこはく） 言葉：静かに燃える心 備考：5月の誕生石のひとつ  ・フォロー＆リツイートでビクトリー10倍 ・さらに勝負運を得たい方はDMまで【仕事】","1638 ","15","1","0"
"シュー神","ShuGod528","アカウントエラー","アカウントエラー","アカウントエラー","アカウントエラー","アカウントエラー","アカウントエラー","アカウントエラー"
"絶対開運・?????｜気功・ヒーリングchika?","chika_heal_","@chika_heal_","絶対開運・?????｜気功・ヒーリングchika @chika_heal_ スターシード、ライトワーカー、ヒーラー、無限のエネルギーのヒーリング 【aiko先生　→ @ai_heal_  】","優しい人ほど、 コーチングをマスターしてほしいです。 そして、優しく人々をより良い方向へ導いてほしいです。  優しさというのは、実は強いエネルギーであり、 この強いエネルギーと正しい術があるからこそ、 人を育てることができます。","1409 ","2","1","0"
"宇宙人カニス??????","CosmosCanis174","アカウントエラー","アカウントエラー","アカウントエラー","アカウントエラー","アカウントエラー","アカウントエラー","アカウントエラー"
"アムムト","ammut852","@ammut852","アムムト @ammut852 冥界の生物。 頭がワニ、体の前がライオン、後ろがカバ。心臓計量時に、冥界に行く資格のない死者の心臓を食べる。","あなたはソウルメイトの存在を信じますか 人間的成長のレベルによりどんなソウルメイトと出会うかが決まります 昔の恋人と似たような人とまた付き合い困る人は自分が成長すると変わります 自身を心から愛する事があなたがより良いソウルメイトと出会い幸せな関係性を持つ秘訣です","1677 ","11","0","0"
"絶対開運・??｜気功・ヒーリングmanami?","manami_heal_","@manami_heal_","絶対開運・??｜気功・ヒーリングmanami @manami_heal_ スターシード、ライトワーカー、ヒーラー、真理を悟るヒーリング 【aiko先生　→ @ai_heal_  】","まずは、どうなりたいかを 明確にしましょう。  多くの人のご相談を頂いて、 ハッキリしていると思っていても 意外とあいまいなことが多いです。","1547 ","8","0","0"
"宇宙人ムルジム?????","CosmosMuljim","@CosmosMuljim","宇宙人ムルジム????? @CosmosMuljim 宇宙人です。フォローしていただくことで、他人に親身になれる使命感のエネルギーを提供いたします。 【総督→ @cosmos_alcor 】","多くの人は自分が幸せになることを願い 生きています  でも自分だけでなく みんなの幸せを考えられれば 考えられる人ほど 幸せというものが何なのか 深い意味で理解できます  あなたはどれだけたくさんの人の 幸せを考えながら 日々を過ごしていますか？","1712 ","15","0","0"
"絶対開運・????｜気功・ヒーリングasuka?","asuka_heal_","@asuka_heal_","絶対開運・????｜気功・ヒーリングasuka @asuka_heal_ スターシード、ライトワーカー、ヒーラー、安らぎのヒーリング 【aiko先生　→ @ai_heal_21  】","式神を出す 式神を使うと、２４時間ヒーリングをしてもらうことができます。 変性意識を深めると、本当に出せるようになります。 ２４時間ヒーリングの方法を学びたい方はDMに【式神】と連絡ください。","1370 ","7","0","0"
"宇宙人プサイ１?????","CosmosPusai1","@CosmosPusai1","宇宙人プサイ１????? @CosmosPusai1 宇宙人です。フォローしていただくことで、時代感覚鋭いハイセンスのエネルギーをお送りいたします。 【総督→ @cosmos_alcor 】","勢いだけでも、 何とかなってしまう 状況もあります。  熱意と行動力があれば、 スタートダッシュは切れます。  上手いやり方は 後から考えても良いです。","1403 ","10","0","0"
"宇宙人ゲンマ??????","CosmosGemma","@CosmosGemma","宇宙人ゲンマ?????? @CosmosGemma 宇宙人です。フォローしていただくことで、主導権を求める指導性のエネルギーをお送りいたします。 【総督→ @cosmos_alcor 】","多分です。来年会員は、1ヶ月で、1日50万円売り上げることも全然出てきます。 実際、この方式で単月の利益で、  10万円 ↓ 50万円 ↓ 25万円  のセールスをした弟子も居ます。 最初は3,000円の売上からでした。  コツを知りたい方は、DMで【ココナラ】の連絡ください。","1319 ","10","0","0"
"アテン神","atengod396","アカウントエラー","アカウントエラー","アカウントエラー","アカウントエラー","アカウントエラー","アカウントエラー","アカウントエラー"
"宇宙人ゲミノールム?????","CosmosGeminorum","@CosmosGeminorum","宇宙人ゲミノールム????? @CosmosGeminorum 宇宙人です。フォローしていただくことで、公平な正義感のエネルギーをお送りいたします。 【総督→ @cosmos_alcor 】","人とのつながりは、 エネルギーを持ちます。  良い人とつながっていると それだけで良いエネルギーを もらえます。  良いつながりを大事にしましょう。","1433 ","43","4","0"
"宇宙人ブレイン??????","cosmosbrain612","@cosmosbrain612","宇宙人ブレイン?????? @cosmosbrain612 宇宙人です。宇宙人の視点を脳科学からの観点を踏まえて呟きます。 【総督→ @cosmos_alcor 】","執着心を断ち切って、静かな境地でいなさい。執着心から生じる「心の汚れ」を、きれいになくせば、苦しみから解き放たれます。","1306 ","10","1","0"
"絶対開運・?????｜気功・ヒーリングkana?","kana_heal_","アカウントエラー","アカウントエラー","アカウントエラー","アカウントエラー","アカウントエラー","アカウントエラー","アカウントエラー"
"宇宙人アルスハイル?????","CosmosAlsuhail","@CosmosAlsuhail","宇宙人アルスハイル????? @CosmosAlsuhail 宇宙人です。フォローしていただくことで、未知を見つめる光る瞳のエネルギーをお送りいたします。 【総督→ @cosmos_alcor 】","どんなことも楽しめる人は 幸せを掴みやすい人です。  チャレンジも楽しみましょう。","1289 ","9","0","0"
"ウアジト女神","GoddessUjito","@GoddessUjito","ウアジト女神 @GoddessUjito 愛と美の女神ヘト＝ヘル（ハトホル）の変形で、北方における日の出時の太陽を表す物と言われている。","やるべきことをどれだけ成し遂げたのか？ 進捗報告をしないといけないならば、 またその進捗報告で評価されるならば、 頑張って毎日、進捗を上げることに徹する。","1414 ","12","1","0"
"宇宙人レポリス??????","CosmosLeporis","@CosmosLeporis","宇宙人レポリス?????? @CosmosLeporis 宇宙人です。フォローしていただくことで、階層世界をクリアにするエネルギーを提供します。 【総督→ @cosmos_alcor 】","名称：サファイア（青玉-せいぎょく／蒼玉-そうぎょく／鋼石-こうぎょく） 言葉：誠実・愛情・慈愛・徳望・不変・高潔・深い海・崇高 備考：ラテン語で「sapphirus（青い色）」が名称の由来","1358 ","11","1","0"
"アメン／アモン(Amun)","AmenAmun964","アカウントエラー","アカウントエラー","アカウントエラー","アカウントエラー","アカウントエラー","アカウントエラー","アカウントエラー"
"リラ／LYRA","LYRA8468","アカウントエラー","アカウントエラー","アカウントエラー","アカウントエラー","アカウントエラー","アカウントエラー","アカウントエラー"
