"flower fairy~恋愛ヒーリング~","flour_fairy1","@flour_fairy1","flower fairy~恋愛ヒーリング~ @flour_fairy1 歳月の流れで形状が変わってしまっても、美しさを保ち続けるドライフラワーの妖精は、あなたの愛のチャクラを高めます。友達になってくれるならば私は恋愛成就のサポートを約束します。そして長きにわたり愛し愛され続けますように。どうかdried flower fairyのメッセージを感じ取って下さい。","清い心を持ちなさい。  そうすれば、森の中で像と像が出会うように、同じ清い心を持つ賢者と、出会うことができるでしょう。","92 ","4","0","0"
"いるかさんのヒーリング(healing)を受け続ける外銀OLちゃん(東京都）","healing_ol","@healing_ol","いるかさんのヒーリング(healing)を受け続ける外銀OLちゃん(東京都） @healing_ol 20代です！仕事、美容、恋愛全部本気です！","積み重ねもなく成功するわけはない。  始めてみて、失敗もして、それからが真のスタート地点である。","909 ","17","1","0"
"第２チャクラの活性化-Crystal Bowl Healing-","healing_bowl","@healing_bowl","第２チャクラの活性化-Crystal Bowl Healing- @healing_bowl 第２チャクラに対応しているといわれる音階「レ・D」のボウルを使用しています。第２チャクラは、丹田（おへその少し下辺り）に位置し、活動力、やる気、活力、パワー、また性的な事柄や子宮などを表します。 【総主→ @g_hzgod 】","最適化ではなく進化を目指す⑫ ではそのエネルギーはどこから来ているのかというと、やはり、とてつもなくやりたい、現状の外側のゴールから来ているんです。  コーチングのday1とも言えるゴール設定ですが、脳の本来持っている力を引き出すための、シンプルかつ強烈な方法論なのです。","809 ","12","0","0"
"自在観時空マニフォールド(Manifold)｜空なる視点の構築","Manifol_Arcane","@Manifol_Arcane","自在観時空マニフォールド(Manifold)｜空なる視点の構築 @Manifol_Arcane 脳に直接働きかけ、他人を思い通りに操作するための秘術を授けます。 人間は一人で出来ることは限られています。 他人をうまく動かせてこそ、大きなことを成し遂げることができるのです。 成功のカギは、あなたが周りの人をうまく動かせるかにかかっています。","他人から自分を切り離して、自分だけの人生を送り、ひそかに快楽が続くように願っているかぎり、行き着くところは孤立の中の死なのだ。","998 ","19","3","0"
"【396Hz】 第1チャクラを活性化し恐怖・不安・トラウマを手放すソルフェジオ周波数音楽","Firstchakra_396","@Firstchakra_396","【396Hz】 第1チャクラを活性化し恐怖・不安・トラウマを手放すソルフェジオ周波数音楽 @Firstchakra_396 この396Hzは恐怖、不安、トラウマなどを解放するといわれています。 396hzの音が第1チャクラを癒し、活性化するともいわれています。 【総主→ @g_hzgod 】","神々とは、決して万能でもなければ優しいものでもない。  されど、人の子をこの世界を憎むものでもない。  人々が神の手無くとも生き抜けることを、神は僅かでも信じている。","489 ","8","0","0"
"セラピスベイレイ(angel)／SERAPIS B","Serapis_angel","@Serapis_angel","セラピスベイレイ(angel)／SERAPIS B @Serapis_angel 天使の領域とコミュニケーションしたければ、セラピスベイ大師と繋がるとよいでしょう。 セラピスベイは天使の領域との強い繋がりを持っているのです。","他人から強制されるとパフォーマンスは低下する。本音でやりたいことだけをやり続ければ圧倒的に高いパフォーマンスを発揮することが出来るということ。競争とか関係ない、他人の評価も関係ない。","501 ","3","0","0"
"宇宙人マヤ(Maya)","Maya963396","@Maya963396","宇宙人マヤ(Maya) @Maya963396 宇宙人です。階層世界をクリアしましょう。フォローしていただくことで、エネルギーを提供いたします。 【総督→ @cosmos_alcor 】","明日こそは、今日は果たせぬ夢を追い、など先延ばしにしていては何も叶わぬ。  本当に大切なものは、すぐに手元に引き寄せるべし。","574 ","5","0","0"
"グランドクロスブッダの階梯 ～超抽象度の閃き(Inspiration)によるゴール現実化","Inspiration1345","@Inspiration1345","グランドクロスブッダの階梯 ～超抽象度の閃き(Inspiration)によるゴール現実化 @Inspiration1345 超抽象度の閃きにより、ゴールを具現化しましょう。 古くから権力者は、人智を超えたパワーに憧れを抱いてきました。 その憧れの超人的パワーの代表格が密教パワーです。  たとえば、ヒトラーはチベットに調査団を送り、仏典を108冊持ち帰っています。その業績をヒトラーは大きく評価しています。","未来を良きものにしたいなら、目の前にある今この瞬間を大切に。  過去は学びだけれど変えられない。  未来は目標だが待っていても来ない。  今をしっかり地に足を付けて歩いた者だけが、学びを糧とし目標にたどり着く。","514 ","9","0","0"
"宇宙人アクルックス(Acrux)","Acrux417","@Acrux417","宇宙人アクルックス(Acrux) @Acrux417 宇宙人です。フォローしていただくことで、理想を目指す努力のエネルギーをお送りします。 【総督→ @cosmos_alcor 】","抽象度とビジネス用語とリンクとして 、「マーケティング」という言葉があります。   これは俯瞰して物事を観るということです。  広い視点で世の中をみて、ニーズやウォンツを探す。 これも抽象度の視点を高くする一つの具体例です。","424 ","26","1","0"
"メルセゲル(Guardian)｜Meretseger","Meretseger_G","@Meretseger_G","メルセゲル(Guardian)｜Meretseger @Meretseger_G 死者の守護者、王家の谷の守り手。 「沈黙を愛する女」といわれ、ヘビの顔をもつ。","あなたがいま病気なら治癒の暗示をしなさい。  暗示の力は強力です。  暗示は人を病気にしますが、また癒してもくれるのです。","499 ","8","0","0"
"宇宙人グルイス(Gruis)","Gruis963396","@Gruis963396","宇宙人グルイス(Gruis) @Gruis963396 宇宙人です。フォローしていただくことで、直感の鋭い芸術性のエネルギーを提供いたします。 【総督→ @cosmos_alcor 】","人を選べ、言葉も選べ。  本音を伝えるべき相手を見抜き、誤解を招かぬ言葉を。  人間関係はその繰り返しで構築される。  誰彼構わず言い振り回すことが衝突を招くのだ。","410 ","7","0","0"
"963 Hzの神の周波数、クラウンチャクラの癒しの音楽、ワンネスへの回帰、スピリチュアルなつながり","963H_god","アカウントエラー","アカウントエラー","アカウントエラー","アカウントエラー","アカウントエラー","アカウントエラー","アカウントエラー"
"【2nd Chakra】人間的魅力を高める　良好な人間関係　幸運　創造性の解放 うつ病治療","Chakra2nd","アカウントエラー","アカウントエラー","アカウントエラー","アカウントエラー","アカウントエラー","アカウントエラー","アカウントエラー"
"第2チャクラ 417Hz 〓マイナスな状況からの回復、変容の促進〓The Second Chakra","2ndChakra_417hz","@2ndChakra_417hz","第2チャクラ 417Hz 〓マイナスな状況からの回復、変容の促進〓The Second Chakra @2ndChakra_417hz 最も世界的に有名なのロイヤル・ライフ博士の周波数を中心に使用した、イヤホンで聴くだけで自己治癒力を高めるとされる周波数が体感できるヒーリングサウンドです。 【総主→ @g_hzgod 】","育児を幸せに感じられないことは悪ではない。  人には向き不向きがあるのは自然なこと。  子を成したとて、その者の性質が変化することを求めてはならない。  ”子をこの世に生み出すだけが天命だった”でも決しておかしいことではない。","417 ","4","1","0"
"望む人生を創造する力を得る　幸運を引き寄せる　引き寄せの法則　528Hz 第３チャクラの活性化","3ndChakra_528Hz","@3ndChakra_528Hz","望む人生を創造する力を得る　幸運を引き寄せる　引き寄せの法則　528Hz 第３チャクラの活性化 @3ndChakra_528Hz 望む人生を創造する力を得るＢＧＭ ５２８ＨＺからできたこのＢＧＭは第三チャクラを活性化させ　成功するためのエネルギー　引き寄せの力を高めます 【総主→ @g_hzgod 】","邪魔をされている気がしても心揺るがされることはない。  それも神に与えられた鍛錬の一つであり、喜んで通過するべし。","522 ","6","0","0"
"コンス神(medical)","cons_medical","@cons_medical","コンス神(medical) @cons_medical ［頭上に満月と三日月を載せたハヤブサ頭をした人物］ アメン神とムゥト女神の子。テーベ神学による。医療神。 テーベの三神の一人でもある","言語を理解すれば、その国の文化も理解できる。  その国の友もできる。  英語でも、中国語でも、フランス語でもいい。  挨拶の言葉だけ覚えたのでもいい。  言葉の扉を開けないのはもったいない。","399 ","2","0","0"
"第一チャクラの浄化・癒し・マイナスの感情・不安・恐怖心・トラウマを浄化し、心を安定させる","1chakra_heel","アカウントエラー","アカウントエラー","アカウントエラー","アカウントエラー","アカウントエラー","アカウントエラー","アカウントエラー"
"741 hzは毒素とネガティビティを取り除き、オーラを浄化し、精神的覚醒、チベットボウル","741hz_clean","アカウントエラー","アカウントエラー","アカウントエラー","アカウントエラー","アカウントエラー","アカウントエラー","アカウントエラー"
"宇宙人アイアン(Iron)","Iron963396","@Iron963396","宇宙人アイアン(Iron) @Iron963396 宇宙人です。フォローしていただくことで、勇猛・強い信念のエネルギーをお送りします。 【総督→ @cosmos_alcor 】","今の苦しい状況を 乗り越えた未来のあなたが  今のあなたを温かく見守っていると 考えましょう。  その感覚を忘れなければ、 最短で「乗り越えた未来」が やってきます。","645 ","25","2","0"
"宇宙人デルタ(Delta)","Delta963396","アカウントエラー","アカウントエラー","アカウントエラー","アカウントエラー","アカウントエラー","アカウントエラー","アカウントエラー"
"宇宙人モルガナイト??????","CosmosMruganite","@CosmosMruganite","宇宙人モルガナイト?????? @CosmosMruganite 宇宙人です。フォローしていただくことで、チャーミング、気立てのよさのエネルギーをお送りいたします。 【総督→  @cosmos_alcor  】","ナニモノであっても終わりの時があり、消滅の流れがあるからこの宇宙は成り立っている。  同じモノを求めるな、創り出そうとするな。  それを求める者の業は深い。","441 ","3","0","0"
"シリウス星の女神｜ソプデト","Sopdet_Sirius","@Sopdet_Sirius","シリウス星の女神｜ソプデト @Sopdet_Sirius ナイルの氾濫を告げる星の神 ソプデトは豊穣を司る女神である他、シリウス星が神格化した存在でもある。 同じエジプトの豊穣の女神イシスと関係が深く、ソプデトの起源はイシスとされる。 【総主→ @g_hzgod 】","悪口を言う人の周りには、悪口を言う人が集まる  ネガティヴな人の周りには、ネガティヴな人が集まります  ネガティヴで不幸な人生を生きていくことになるのです  他人の長所を見つけるのが上手い人の周りには、良い人が集まる  ポジティブな人の周りには、ポジティブな人が集まる  幸せへの道です","490 ","12","4","0"
"639 hz関係を調和、愛とポジティブなエネルギーを引き付け、古いネガティブなエネルギーを癒す","639Hz_love","@639Hz_love","639 hz関係を調和、愛とポジティブなエネルギーを引き付け、古いネガティブなエネルギーを癒す @639Hz_love 639 Hzの周波数は、人間関係における開放性とつながりに関連しています。 家族内、パートナー間、友人間、または社会的文脈での問題を治療するために使用されます。 それは細胞が周囲とコミュニケーションすることを奨励し、理解、寛容、愛の調和のとれた関係を作り出します。 【総主→ @g_hzgod 】","「苦しみを自覚する」⇒「苦しみの原因を知る」⇒「苦しみを捨てる決心をする」⇒「苦しみを捨てる方法を知る」 この一連の過程を心得ている人は、幸せに生きていけるでしょう。","496 ","25","7","1"
"ソルフェジオ周波数417Hz♪幸せと魅力の宝庫、第2チャクラを癒す音楽","2chakra_sol","@2chakra_sol","ソルフェジオ周波数417Hz♪幸せと魅力の宝庫、第2チャクラを癒す音楽 @2chakra_sol 幸せと魅力の第2チャクラを癒す。マイナスの状況からの回復、変容の促進をうながす効果があるとされています。 【総主→ @g_hzgod 】","何があってもぶれずにゴールに向かう、壁にぶつかって上手くいかない場合だからこそ、エフィカシーを高く維持しよう。","393 ","19","2","1"
"528Hzポジティブトランスフォーメーション、感情的および肉体的治癒、抗不安、再生","528Hz_healing","@528Hz_healing","528Hzポジティブトランスフォーメーション、感情的および肉体的治癒、抗不安、再生 @528Hz_healing 528 Hzの周波数は、人々に深い精神的な体験や精神的な光をもたらす可能性を与えます。 DNAを再生し、調和させます。 これがもたらす利点は次のとおりです。生命エネルギーの増加、心の明快さ、意識、覚醒または活性化された創造性、深い内なる平和、ダンス、お祝いなどの恍惚とした状態。 【総主→ @g_hzgod 】","自分より優秀な人と出逢ったら、 なるべくその人の近くへ行き、なるべく話を聴き、どんな思考で生きているのかを学ぶとよい。  その人のように生きるヒントを得られる。","371 ","7","1","0"
"仮空中と超越(Transcendence)","Transcend112","@Transcend112","仮空中と超越(Transcendence) @Transcend112 人と人の間で強烈な情報のやり取りにより何らかの行動が促される現象。 長年の探究の結果、この現象を再現できる行き過ぎた科学は、スピリチュアルやオカルトのように聞こえることもあります。 そして、科学と宗教を追求し続けると、 反対のベクトルだったものが抽象度の高いところでぶつかる感覚に襲われます","調子が良いときに ふと浮かんだり、 口をついて出る言葉は  あなたに力を与える パワーワードです。  メモなどに 書き留めておくと良いです。","401 ","7","0","0"
"acount8","Diamond_cosmos","アカウントエラー","アカウントエラー","アカウントエラー","アカウントエラー","アカウントエラー","アカウントエラー","アカウントエラー"
"＜第１チャクラ＞ムーラダーラ・チャクラ ルートチャクラ 生命力 情熱 バイタリティ 行動力 開拓力","1_firstchakra_V","@1_firstchakra_V","＜第１チャクラ＞ムーラダーラ・チャクラ ルートチャクラ 生命力 情熱 バイタリティ 行動力 開拓力 @1_firstchakra_V このヒーリング動画では、生命力やバイタリティの源泉である＜第１チャクラ＞の浄化と活性化をおこないます。 第１チャクラは、罪悪感（罪の意識）や恐怖によってバランスが崩れるため、第１チャクラの浄化と活性化は、罪悪感や恐怖心の克服につながります。 【総主→ @g_hzgod 】","ムダな努力はしなくていいが、それは「できる限りの努力をした」人の次のステップである。","324 ","1","0","0"
"第7チャクラ活性化 宇宙エネルギー「プラーナ」引き寄せの力　天運に恵まれる　九死に一生を得る","7Chakra_Prana","@7Chakra_Prana","第7チャクラ活性化 宇宙エネルギー「プラーナ」引き寄せの力　天運に恵まれる　九死に一生を得る @7Chakra_Prana 第7チャクラが活性化されると、頭頂部から宇宙のエネルギー「プラーナ」をダイレクトに取り込む事ができます。第七チャクラが活性化された人は運があり天職で活躍します。 そして九死に一生を得る　チャンスを生かすといった特徴のある人生が開けてきます。 【総主→ @g_hzgod 】","何事も客観視することが大事。  主観的になりすぎて立ち往生しているのは人間だけ。","302 ","4","0","0"
"織姫｜伝承","orihime_ten","@orihime_ten","織姫｜伝承 @orihime_ten 天女は時に人間界へ恋焦がれ降臨いたします。 美しさを司る神々は、切ない女心に寄り添います。 どうせ生き抜くならば幸せになって欲しいと、人々へ馳せる想いを織姫様は私に託すのです。 それを伝言する天命を持ち、私はこの世に生を受けてしまいました。 水辺の社にて巫女としても日々学んでおります。","信じることは、疑わないことと同義では無い。  信じているからこそ、疑わねばならぬ時もある。  小さな疑いを晴らし、重ね重ねた信頼が大切なのだ。","520 ","19","0","0"
"愛の女神｜ハトホル","love_god934","@love_god934","愛の女神｜ハトホル @love_god934 母なる女神、若く美しい恋人、時には慈愛に満ちた母 セトとホルスが戦った時、ホルスの傷を癒した。ここから治療の神とされる。 また死者を冥界に導くとされる。【総主→abrhm_21】","コーチングとは一度死ぬことです。  なぜかといえば、過去の世界観を基準とした生き方から抜け出して、 全く別の人生を歩むことになるからです。  これは大げさなたとえ話ではなく、本当のことです。","313 ","5","0","0"
"acount10","healing_HSP","@healing_HSP","acount10 @healing_HSP 性の同一などは、どうでもいい問題。  もし、体と心の一致を認めない者がいるならば、『ナニサマだ』と指を刺して笑ってやればよい。","性の同一などは、どうでもいい問題。  もし、体と心の一致を認めない者がいるならば、『ナニサマだ』と指を刺して笑ってやればよい。","333 ","6","0","0"
"現状の外側(senses)｜自動的に成功する","senses_success","@senses_success","現状の外側(senses)｜自動的に成功する @senses_success 人間はみんな知らないうちに、自分はこういう人物であるという固定観念に縛られて生きています。 もしもこの観念の枠を取り去ることが出来たなら、あなたの意識の幅を広げることが出来たなら、ありとあらゆることが可能になってきます。","あなたが存在しているのはわけがあるの。  あなたの存在目的は、人間として可能な限りの力を発揮し、人類に貢献することにあるのだから。  目標を設定することで、自分自身や人のためにより多くのことが達成できる。","299 ","3","0","0"
"ピアノヒーリング 表現する 第5チャクラ","5Chakra_Piano","@5Chakra_Piano","ピアノヒーリング 表現する 第5チャクラ @5Chakra_Piano 表現をする、想いを伝える、肩の力を抜いて本当の気持ちを誰かに伝えるとしたら、何を伝えますか？自分の素直な気持ちにフォーカスして、それを探すように聴いてみてください。 【総主→ @g_hzgod 】","人は『依存』により幸福感を得ることができるけれど、『依存』の数が少ないと、必要以上に幸福感をむさぼり依存症に陥る。  『依存』するものが多ければ、活動的になり視野が拡がり、知的好奇心が育つ。 『依存』を間違えないこと。","341 ","-","0","0"
"祇園信仰｜花街からの伝言","gion_mai34","@gion_mai34","祇園信仰｜花街からの伝言 @gion_mai34 この街は神々の声が飛び交っています。その心地の良い響きを皆様にも届けたい。どうか私がメッセンジャーになることをお許しください。","終わりがないということは、前進あるのみということである。  そして前進するということは、つねに挑戦を忘れないということ。","589 ","11","3","0"
"セベク(God)","Sebek_God","アカウントエラー","アカウントエラー","アカウントエラー","アカウントエラー","アカウントエラー","アカウントエラー","アカウントエラー"
"第６チャクラ、第三の目を活性化するＢＧＭ　宇宙意識　直観力　第六感　記憶力　成功イメージの具現化","6Chakra_bgm","@6Chakra_bgm","第６チャクラ、第三の目を活性化するＢＧＭ　宇宙意識　直観力　第六感　記憶力　成功イメージの具現化 @6Chakra_bgm 第６チャクラを活性化させれば第六感、直観力が高まり自分の人生を切り開いていくことができます スピリチュアルなものを感じる能力、広い視野をもつことが出来る能力、遠くのにおいを感知し離れている人の感情を察知する能力、風水環境を感知する能力、人に会う前に認識する能力、未来予知を行う能力を高めます。 【総主→ @g_hzgod 】","一日一つのよい行い。 よい言葉。 よい誠意。 その積み重ねが、大きな幸せを育てていく。","317 ","4","0","0"
"聖母マリアとヨセフ／聖霊、宇宙(cosmos)天使の存在","cosmos_Malia","@cosmos_Malia","聖母マリアとヨセフ／聖霊、宇宙(cosmos)天使の存在 @cosmos_Malia デザイン・絵・工芸・文字アート・演劇などの表現をする力、声、音楽、言葉など、人間が心に抱いている形のないものを形にして表現する力を高める。 コミュニケーション、表現力だけでなく、あらゆるしがらみから解放されて、あなたの魂を高次元的に自由な世界に開放する。","食べることは人間に不可欠であるが、だから何をどう食しても良いということではない。  食物となる生き物に感謝を、絶やすこと無く食物を与える自然に敬意を。","346 ","8","0","0"
"第5チャクラ スピリチュアル能力の活性化 表現力・創造性の開花 魂の開放 具現化 甲状腺治療","5Chakra_spi","@5Chakra_spi","第5チャクラ スピリチュアル能力の活性化 表現力・創造性の開花 魂の開放 具現化 甲状腺治療 @5Chakra_spi 第5チャクラが活性化されると穏やかで自信に満ち人から慕われるようになります 自分の考えを表現することが上手で、コミュニケーションがうまく、ユーモアがあり人に好まれるようになります。 表現が上手なので、相手はその人を理解するようになり、人に誤解をされにくく、人間関係のトラブルも少なくなります。 【総主→ @g_hzgod 】","変性意識の力＝無意識の力です。 無意識というのはすべての生物に備わっています。  変性意識の力は生命力そのものだと言えるんです。 私は変性意識のおかげで人生を凄く充実させることが出来ました。","298 ","6","0","0"
