"零点エネルギーヒーリング","flag1984","@flag1984","零点エネルギーヒーリング @flag1984 零点エネルギーで、ライトボディを活性化して、エネルギーフィールドを浄化します。物理体・プラズマ体・アストラル体・メンタル体・エーテル体。さらにその上が魂、そしてソースへ。ライトボディは魂の意識のスパーク。ライトボディは自分の宇宙船。すべての物がつながるとライトボディになってアセンションして光となる。","誰かに良いものを与えてください。 すると、あなたはさらに良いものを得られます。","785 ","5","0","0"
"対異性的な魅力増強","H7dfUZfL","@H7dfUZfL","対異性的な魅力増強 @H7dfUZfL 対異性的魅力の増強(Sexuality)とは、松果体か?活性化す ることて?、精巣、卵巣なと?の内分泌腺から正常なホルモ ンの分泌を促すものて?す。  エシ?フ?トの女神イシスのエネルキ?ーと繋か?ることか? て?きますか?、そのために、女神イシスからのテストをク リアする必要か?あります。","夢や目標はあなたの存在意義です。 望むものが、大きく力強いほど、 あなたは大きく力強い存在になります。","612 ","2","0","0"
"シュウ｜Shu","ShuGod3547","@ShuGod3547","シュウ｜Shu @ShuGod3547 大気の神、創世の神。 アトゥムによって最初に作られた神。","欲しがらなければ、 手に入りません。  欲しがることに 躊躇するクセがあると もったいないです。  もっと欲しがって良いのです。","473 ","1","0","0"
"絶対開運・?????｜気功・ヒーリングrei?","rei_heal_","アカウントエラー","アカウントエラー","アカウントエラー","アカウントエラー","アカウントエラー","アカウントエラー","アカウントエラー"
"セケル神","SekerGod","@SekerGod","セケル神 @SekerGod セケル神はしばしばプタハ神と結びついて、プタハ＝セケル或いは、プタハ＝セケル＝オシリスとして出てくる神で、死者の復活に関係があり、しばしば護符に子の神の名前を書き、時には内部に「死者の書」の一部を記した文章が収められた。 元来は肥沃と大地の神、主として死者の守護神として崇拝された。メンフィスの墓地の守護神","２倍の結果を出そうと思ったら、  ２倍努力するのも 一つの方法ですが、  ２倍効率が良い やり方を考える、  という方法が 最適です。","2337 ","7","1","0"
"長谷川りな～恵天使のヒーリング～","yASjI9XrWH8R","@yASjI9XrWH8R","長谷川りな～恵天使のヒーリング～ @yASjI9XrWH8R 音楽家／アークエンジェル","お金を使うときに、 何を買うのでも、  「これは自分を高めるか？」 という視点で使うのは 重要です。  生活必需品以外は、 （できれば生活必需品も） 自分を高めるためだけに お金を使うべきです。","2493 ","20","0","0"
"巫女るか～無償ヒーリング","Priestessiruka","@Priestessiruka","巫女るか～無償ヒーリング @Priestessiruka 某占いコミュニティ1位獲得。 20代半ば、ルカさんに仕えて年収1,000万円3年連続達成中  ・階級：超次元オルデン抽象コード ・スキル：霊視、透視、ヒーリング、祈祷、神念、事業成功念、恋愛成就、金運10倍。  私と個別に繋がってくれる方は、フォロリツお願いします(^^)事業相談はDMまで【一念】。","『フォローで厄除け・リツイートで開運』奇跡のアファメーション 感情の起伏が少なく、いつも穏やか。お気に入りの音楽やコーヒーがあれば、機嫌よく一日が過ごせるようです。  花の画像を載せてますので、フォロワー様が癒されますように。","2845 ","77","13","4"
"抽象度の臨界点の伝授｜十二束のDNA／生命エネルギーの波動／ソウルスターチャクラ","Luannegreenwoo1","アカウントエラー","アカウントエラー","アカウントエラー","アカウントエラー","アカウントエラー","アカウントエラー","アカウントエラー"
"働かなくて良い世界を実現する＠意識を拡大させ固定観念からの脱出、自分を変える、無限の可能性","evettemeadezq5","@evettemeadezq5","働かなくて良い世界を実現する＠意識を拡大させ固定観念からの脱出、自分を変える、無限の可能性 @evettemeadezq5 第８チャクラのキーワード 宇宙・輪廻・魂・至福の喜び・究極の目標","貴方の家は綺麗ですか 家の状態は貴方の頭の中の状態と殆ど一致しています 家が整理整頓されていないなら貴方の頭は少し複雑に考え過ぎかもしれません いらない物があるなら人生で不必要なものまで無意識に背負っていることもあります いらないものは捨てて自分らしく生きましょう","2286 ","8","1","0"
"??? 開運神社～除霊 除霊 お祓い","sananda174","@sananda174","??? 開運神社～除霊 除霊 お祓い @sananda174 奥の宮の天空に忽然と鳳凰（火の鳥）が出現し、乱舞する幻想的な姿が見れる唯一の神社。開運・金運・仕事運アップ、復縁・恋愛・結婚運の上昇、夢を実現する、具現化、幸せになる、変化を起こす","名称：アクアマリン（藍玉-あいぎょく） 言葉：幸福に満ちる（他） 備考：「人魚石」とも呼ばれる事があった  ・フォロー＆リツイートで幸福度10倍 ・さらに幸せになる方はDMまで【オーラ】","2215 ","26","1","1"
"【眠りながら】無限に富を引き寄せる話神々の集い","sarahencef","@sarahencef","【眠りながら】無限に富を引き寄せる話神々の集い @sarahencef うとうとしている時は、意識が下がって、言葉が潜在意識に届きやすくなります。毎日、できるだけ多くの回数を行ってってください。  毎日、何回もアファメーションを聴いたり、唱えたりすることで、潜在意識に定着します。最低三週間続けて、習慣化してください。何らかの良い効果を実感することができます。","運気を上げるには 運気が高い人の影響を受けるのが 一番です。  その人が何をやっているか、 物事にどう反応しているか、 何を大事にしているかを  感じてみましょう。","2283 ","28","2","1"
"宇宙人アレキタイプ??????","CosmosAlekitype","アカウントエラー","アカウントエラー","アカウントエラー","アカウントエラー","アカウントエラー","アカウントエラー","アカウントエラー"
"窮地を回避／神秘体験／テレパシーの間","kyuchiwokaihi","@kyuchiwokaihi","窮地を回避／神秘体験／テレパシーの間 @kyuchiwokaihi チャクラの目覚めは、肉体の周波数を上昇させる。 ソウル・スターチャクラの目覚めは視覚が変わり、聴覚が変わり、第六感が起こり寿命が長くなる。","フォローで開運 リツイートで加速","2149 ","16","0","0"
"レムリアの光／太古人類は光っていた","rSO7YoCLnlMed44","@rSO7YoCLnlMed44","レムリアの光／太古人類は光っていた @rSO7YoCLnlMed44 アジーナチャクラ 物質的には脳下垂体  これが刺激されると第九感が 目覚め　鋭敏な感覚　創造的 知性が働き、人は神聖な観念 を抱くようになる","ポジティブな言葉を使う。  使う言葉によって、人生は大きく変わる。  前向きになれる言葉を使いましょう。  「どうせ無理だから」ではなく「やってみようかな！」  こういう言葉を使うと、あなたもあなたの周りの人たちも変わります。  人生はあなたが思うよりシンプルです。","2318 ","23","4","0"
"宇宙人アルケス?????","CosmosAlkes","アカウントエラー","アカウントエラー","アカウントエラー","アカウントエラー","アカウントエラー","アカウントエラー","アカウントエラー"
"宇宙人セドナ?????","CosmosSedona","@CosmosSedona","宇宙人セドナ????? @CosmosSedona 宇宙人です。フォローしていただくことで、ボルテックスのエネルギーを送りいたします。 【総督→ @cosmos_alcor 】","名称：ダイオプサイド（透輝石-とうきせき） 言葉：幸せへの道しるべ 備考：ほかにも白色・褐色・黒色などが存在する  ・フォロー＆リツイートで幸福感10倍 ・さらに幸福を得たい方はDMまで【HAPPY達成】","2101 ","16","0","0"
"宇宙人アンモライト?????","CosmosAmmolite","@CosmosAmmolite","宇宙人アンモライト????? @CosmosAmmolite 宇宙人です。フォローしていただくことで、過去の思い出のエネルギーをお送りいたします。 【総督→ @cosmos_alcor 】","名称：ペクトライト（曹珪灰石-そうだけいかいせき） 言葉：愛・平和・理解・協調 備考：特に「愛と平和を象徴する」と言われている","2006 ","18","1","0"
"宇宙人フルオライト??????","Cosmosflu269","@Cosmosflu269","宇宙人フルオライト?????? @Cosmosflu269 宇宙人です。フォローしていただくことで、過去と未来のエネルギーをお送りいたします。 【総督→ @cosmos_alcor 】","名称：ブルータイガーアイ（青虎眼石-あおとらめいし） 言葉：洞察力・好奇心・独立・知識・富貴 備考：「天空を翔る鷹」とも呼ばれている","1960 ","36","1","0"
"アケク","akeku528","アカウントエラー","アカウントエラー","アカウントエラー","アカウントエラー","アカウントエラー","アカウントエラー","アカウントエラー"
"挙動不審マリア@ヒーリング好きの外銀OLちゃん(東京都）","kXEd8hpLDYVH","@kXEd8hpLDYVH","挙動不審マリア@ヒーリング好きの外銀OLちゃん(東京都） @kXEd8hpLDYVH マリアです。 ADHD・HSPの繊細さんまっしぐらの過去あり。 ヒーリングによって救われました！ 20代年頃です／仕事、美容、恋愛全部本気ですっ！","今のあなたに不満があるなら、 あなた自身を 作り替えていくしかありません。  ヒーリングを利用すれば それはそれほど難しくありません。","2015 ","27","2","0"
"セクメト｜Sekhmet","ngaKh7Wb","@ngaKh7Wb","セクメト｜Sekhmet @ngaKh7Wb 「強力な女性」／雌ライオンの頭部を持つ女神","一人では難しいチャレンジは ""質問できる""という環境が とても大切になります。  ヒーリングを受けられた方も、 質問のやり取りで急成長される方が 多いです。","2036 ","16","0","0"
"宇宙人シェアト????","CosmosSheat","@CosmosSheat","宇宙人シェアト???? @CosmosSheat 宇宙人です。フォローしていただくことで、笑顔と心の優しさのエネルギーを提供いたします。 【総督→ @cosmos_alcor 】","反抗とは何かに対する反応であり、反発することであって、それはそれ自身の制約作用によって自縛状態を招くだけである。どの世代も過去の世代に制約されているので、単に制約条件に反抗するだけでは、すでに制約され条件付けられた精神を自由にすることはできない。","1975 ","17","0","0"
"零点ライトボディのアクティベーション","ferhypfx","@ferhypfx","零点ライトボディのアクティベーション @ferhypfx あなたはアバター〔神の資質が人間の体をもってこの地球に転成した存在〕の能力を体現しはじめます。  まさにみずから望んだ場所に、望んだ時間にいられるということを意味しています。あなたは「根源」や存在するものすべてと一体だという意識に完全に目覚めているため、ライトボディのこのレベルでは幻視、物質化などの能力が具現化する。","あなた自身のエネルギーを整えるのも大切ですが、 人間関係も大きな影響力を持ちます。 良い人間関係はあなたを力強くサポートします。","1958 ","11","0","0"
"玉城のえる｜受けないと苦しむ黄金のヒーリング","Y7YOB6OxgWQa","@Y7YOB6OxgWQa","玉城のえる｜受けないと苦しむ黄金のヒーリング @Y7YOB6OxgWQa あなたの身体はストランドの全長をスキャンし、DNA内のエネルギー的な痛みを癒していきます。 私たちのDNAはとてももろく、環境の毒素や発ガン要因を受けやすいものです。適切な食品、新鮮な空気、そしてDNAセラピーを通じて、もとの状態を維持することがとても重要です。","仕事が辛いという方へ  サラリーマンは実際に体験してみるとものすごく活力を奪われます。 週に５日で残業まであったら、相当集中力もエネルギーもなくなります。  でも、どこかのタイミングで脱出するタイミングが必ずあります。 逆風の中でタイミングを図り、風が弱まったら一点集中で脱出します。","2017 ","12","0","0"
"宇宙人クラテリス??????","CosmosCrater63","@CosmosCrater63","宇宙人クラテリス?????? @CosmosCrater63 宇宙人です。フォローしていただくことで、仲間意識の強さのエネルギーをお送りいたします。 【総督→ @cosmos_alcor 】","未来の夫や妻に夢の中で対面することがよくあります。  あなたが、将来の伴侶に望ましいと思う性質について瞑想し、潜在意識に伝達することができれば、潜在意識はあなたの理想とする人の面影を予見させてくれます。","2000 ","35","0","0"
"FullDisclosure｜細胞を修復　記憶力ＵＰ　松果体を活性　メラトニン分泌　老化防止","J3WmySwOEXPi","@J3WmySwOEXPi","FullDisclosure｜細胞を修復　記憶力ＵＰ　松果体を活性　メラトニン分泌　老化防止 @J3WmySwOEXPi NK細胞の活性化作用により、ガンや動脈硬化などの細胞の酸化によって生じる病気を防いだり、がん細胞の増殖や病状の進行を抑える効果も報告されており、がん治療などにも利用されているようです  また高次元・宇宙意識と繋がるとも言われています","ここ数日で申込者がかなり増えています。 申込みの速さや文面で、この人は成功するというのがすぐに分ってしまいます。  本気であれば、道は一直線。 本気でないなら、何年も、何十年も、同じ繰り返しになります。","2079 ","41","0","0"
"宇宙人イオタ??????","CosmosIota","アカウントエラー","アカウントエラー","アカウントエラー","アカウントエラー","アカウントエラー","アカウントエラー","アカウントエラー"
"宇宙人クサイ?????","CosmosXi639","@CosmosXi639","宇宙人クサイ????? @CosmosXi639 宇宙人です。フォローしていただくことで、さびしがり、頼りなさの魅力のエネルギーをお送りいたします。 【総督→ @cosmos_alcor 】","あなたが普段一緒にいる人は あなたの潜在意識に 様々な情報を書き込みます。  一緒にいる人と 似てくるのです。  誰と時間を過ごすかを しっかり考えましょう。","1769 ","19","1","0"
"第４チャクラエネルギー封入の間　傷ついた心を癒す　心のヒーリング　心の安定　幸福感　カリスマ性","GodfrwRobbin","@GodfrwRobbin","第４チャクラエネルギー封入の間　傷ついた心を癒す　心のヒーリング　心の安定　幸福感　カリスマ性 @GodfrwRobbin 第４チャクラが活性化した人は、愛に満ちていて見返りを求めず喜んで人のために尽くすので、人から好かれ、信頼されます。 そしてカリスマ性を持ち、人を魅了するようになります。  また第４チャクラが活性化した人は悲観せず明るく、やさしさ、愛に満ち、自分に対しても人に対しても肯定的であり人間関係も円滑で他人をも幸福にできる","あなたが 思いきり力を発揮できたときが  どういうときだったかを 思い出してみましょう。  その状況に 人生を変えていく ヒントがあります。","2112 ","29","1","1"
"神氣・天眼・神通力／天内れい","lagging1977S","@lagging1977S","神氣・天眼・神通力／天内れい @lagging1977S 学びたくて学習する、やりたくて知識を習得する、それがコーチングを実践するということ。机に向かって勉強するスタイルを否定するわけではないが、リラックスして前頭前野を使っているかどうか、抽象度の高い思考しているか常に要チェックだ。","学びたくて学習する、やりたくて知識を習得する、それがコーチングを実践するということ。机に向かって勉強するスタイルを否定するわけではないが、リラックスして前頭前野を使っているかどうか、抽象度の高い思考しているか常に要チェックだ。","1987 ","24","1","0"
"宇宙人アクベンス?????","CosmosAcbens","アカウントエラー","アカウントエラー","アカウントエラー","アカウントエラー","アカウントエラー","アカウントエラー","アカウントエラー"
"アポピス","Apopis68","@Apopis68","アポピス @Apopis68 ［蛇］ 邪悪と敵意にみちた暗黒の化身","思いもよらない事態は 必ず起こるものです。  それも「起こるものだ」と 理解していれば、  乗り越えてさらに進めます。","1899 ","22","2","0"
"Dr.伊勢谷～コスメティックヒーリング～","97Pxj4MyoMH3","@97Pxj4MyoMH3","Dr.伊勢谷～コスメティックヒーリング～ @97Pxj4MyoMH3 美容外科。伊勢谷ワークス代表｜美容気功を受けると、小顔になってきれいになります。  またパーツの大きさとバランスが整って印象が変わります。  美容気功ではオーラにも働きかけます。  異性からの人気も自然と出て来ます。","未来のあなたが 素晴らしい状態なのですから  今のあなたはそこに向かっている ベストな状態です。  すでにあなたは素晴らしいのです。","1841 ","14","3","0"
"DNA活性化／レイキマスター／サイキックプロテクション／karo","ngocbachnguyen","アカウントエラー","アカウントエラー","アカウントエラー","アカウントエラー","アカウントエラー","アカウントエラー","アカウントエラー"
"ベンヌ｜Bennu","o1cEbnHW","@o1cEbnHW","ベンヌ｜Bennu @o1cEbnHW 不死の霊鳥。 鮮やかに舞い上がり光り輝く者。","名称：ピンクサファイア（青玉-せいぎょく） 言葉：愛嬌・儚さ・無情 備考：9月の誕生石のひとつ","1782 ","30","1","0"
"空の包摂｜西洋汎神・東洋縁起","YFlhtXuaq3Bh","@YFlhtXuaq3Bh","空の包摂｜西洋汎神・東洋縁起 @YFlhtXuaq3Bh 人間と人間の間で強烈な情報のやり取りにより何らかの行動が促される現象。 長年に亘る探究の結果、この現象を再現できる形。 行き過ぎた科学はスピリチュアルやオカルトのように聞こえることもあります。  そして科学と宗教を追求し続けると、 反対のベクトルだったものが抽象度の高いところでぶつかる感覚に襲われます。","コーチングの活動を一生涯続けていくと決めるならば、 その気持ちが変わってもいいので、 まずはサポートセンターに【コーチング人生】とDM下さい。 最善の手ほどきをします。 その手ほどきと結果を見て、今後どうするのか？ 一緒に決めていきましょうね。","1739 ","20","0","0"
"縁結び・縁切り","Matchmaking123","@Matchmaking123","縁結び・縁切り @Matchmaking123 縁結び・復縁エネルギーは、エーテル界・アストラル界より、双方の魂のコードに働きかけるものです。  縁結び・復縁エネルギーは、高次元の繊細なエネルギーのために、即座に体感が出ないと言われる方もいますが、これまでの施術数は数百人を超え、その効果は絶大です。","心がまったく新しいものと出会うことができるのは、心が孤独で何ものにも影響されず訓練されず、様々な経験によって支えられていない場合に限られる。","2198 ","17","0","0"
"プタハ｜Ptah","pdI1oMLU","@pdI1oMLU","プタハ｜Ptah @pdI1oMLU 顔美しきもの、死者の姿で現される神。","一つの事に大量の時間を注げば 必ずそれなりの結果がついてきます。  色々なものをつまみ食いしているだけでは エネルギーが分散します。  ある程度の期間を決めて、 全ての時間をそれに注いでみましょう。","1719 ","10","0","0"
"アンドロメダ／ANDROMEDA","bJdSU7GU","@bJdSU7GU","アンドロメダ／ANDROMEDA @bJdSU7GU 物質次元での生活を支援。健康、人間関係、財政を含む３次元的な生活を強化。","エフィカシーは堂々と上げて良い、既にエフィカシーが高い人も更に上のレベルに向けて高くして良いのだ。誰かの許可も不要、自分で勝手に上げて行けば良い。どこまでもどこまでも高く出来るのがエフィカシー。","2040 ","33","1","1"
"タウエレト｜Tawaret","Tawaret21a31","@Tawaret21a31","タウエレト｜Tawaret @Tawaret21a31 大いなる母。 大きな乳房と護符「サァ」を持つ。 雌のカバの姿。","フォローで開運 リツイートで加速","1882 ","24","4","0"
"クヌム神","KhnumGod","@KhnumGod","クヌム神 @KhnumGod ［牡羊の頭をした人物として表される］ アスワンのエレファンティネ島の神。第１急湍の神。ナイルの水の主。陶工の神。 ろくろ台の上で人間を作り出したと考えられた。","先延ばしは思考のクセです。  普段から、小さなことでも 「あれやろう」と思ったら 思った瞬間に行動に移すように しておけば、  すぐにやるクセが ついていきます。","1371 ","9","1","0"
"絶対開運・????????｜気功・ヒーリングharuka?","haruka_heal_77","@haruka_heal_77","絶対開運・????????｜気功・ヒーリングharuka @haruka_heal_77 スターシード、ライトワーカー、ヒーラー、感謝のエネルギーのヒーリング 【aiko先生　→ @ai_heal_21  】","■『依存について』② 依存しないと生きていけないこともある。 依存を無くすと生きる意味さえも失ってしまう。 依存は無くすのではなく、 悪い依存ならば良い依存に変える。","980 ","5","0","0"
"ギザの繁栄、成功、病氣の治癒","saopon0624","アカウントエラー","アカウントエラー","アカウントエラー","アカウントエラー","アカウントエラー","アカウントエラー","アカウントエラー"
"宇宙人ホープ","hopecosmos235","@hopecosmos235","宇宙人ホープ @hopecosmos235 宇宙人です。フォローしていただくことで希望のエネルギーをお送りいたします。 【総督→ @cosmos_alcor 】","本当はもっとできると確信しましょう。 実際にもっとできます、  いつも、最高の全力だけを 出し切って生きている人なんて そうそういません。","1683 ","17","1","0"
"月収３００万へ導き～苫米地式コーチング～神法／太陽神経叢／マスターヒーラーあい","m2JkYcw9PPhK","@m2JkYcw9PPhK","月収３００万へ導き～苫米地式コーチング～神法／太陽神経叢／マスターヒーラーあい @m2JkYcw9PPhK アセンションビジネススクール代表 マスターヒーラー アセンションカンファレンス2017/2018 ファシリテーター／プロジェクトディレクター アセンションジャパン認定／アセンションディプロマ認定  #ヒーリング #占い #気功","多くの人は自分が幸せになることを願い 生きています  でも自分だけでなく みんなの幸せを考えられれば 考えられる人ほど 幸せというものが何なのか 深い意味で理解できます  あなたはどれだけたくさんの人の 幸せを考えながら 日々を過ごしていますか？","1500 ","6","1","0"
"宇宙人ジャスパー??????","CosmosJasper021","@CosmosJasper021","宇宙人ジャスパー?????? @CosmosJasper021 宇宙人です。フォローしていただくことで、体力・持久力のエネルギーをお送りいたします。 【総督→ @cosmos_alcor 】","同じことを言っていても 裏側にどんな思考が 巡っているかによって まったく意味が変わります。  思考をキレイにしていけば 何気ない一言が 大きな力を持ちます。","945 ","7","1","0"
