"itako28","@itako28","いたこ28号/北極ジロ @itako28 某秘密毛社の社員。たまに趣味の怪談で小金を稼いでます。TV番組やDVD作品や書籍やトークライブ等でなんか叫んでます。…エロエロアザラク。エロエロザメラク。たけしの超常現象マル秘Xファイルに出たことあるよっと。竹書房「憑依怪談 無縁仏」発売中　http://youtube.com/user/zzzcokeshi","3/26?10:00～ 【りゅうあツアー第4弾「箱根巡り」開催！】  箱根のパワスポ巡ろう！ なんと、スペシャルゲストとしていたこ28号さんもお越しくださいます♪ 参加費4000円(行きのロマンスカー&箱根遊覧船代込み)  ご予約はryuaofficial@yahoo.co.jpまでお願いします！","1.3万 ","70","8","2"
"batapys1","@batapys1","違法バタピー @batapys1 そろそろ月読の準備をし、掃除もしておくか…","嫌だろ種付けおじさんみたいなかけ声で腰振るスレッタ","1.2万 ","037","5","6"
"kokoro_kaori358","@kokoro_kaori358","心と体を癒すセラピスト Kaori. @kokoro_kaori358 食や考え方、体に取り入れるものを変えたら人生好転体も健康にネガティブ思考→ポジティブ思考になんでもない毎日が幸せ食べたもので体はできている食べたもので心もできているいきいきと健康で幸せな毎日を過ごしていきましょう","明日は6:26ごろ太陽が牡羊座に入り、宇宙元旦となります。  牡羊座は12サインのスタート地点  22日の新月も、牡羊座の0度で起こり、 まさに「スタート」  不安を抱きながらも、新しいことをスタートさせてみましょう  24日には冥王星が水瓶座に入り、いよいよ風の時代が本格的に始まります","2057 ","243","99","12"
"ku_happysky","@ku_happysky","くうくらしを整える @ku_happysky 人生を楽しむための「子育て」「家計」「暮らし」の秘訣を図解で発信｜小中高大大の5人の母｜専業主婦7年?個人事業主16年｜挑戦が大好きな子沢山ワーママ｜週1月1忘れがちな掃除家事リマインド｜英検1級｜娘たちに伝えたいくらしの知恵を綴ります","上の激落ちくんも40％オフだし、このお気に入りも割引してる♪こちらはくう愛用の安心安全な殺菌消毒「パストリーゼ」洋酒メーカーが作ったので口に入ってもＯＫ．アルコール濃度77％の最適な消毒効果にカテキン抗菌で家中使えます！ https://amzn.to/3G0uAEL #ad","11000 ","057","8","0"
"sirochan8600","@sirochan8600","しろちゃん＠母子家庭応援団×Webライター @sirochan8600 占術使いの母子家庭サポーター→子ども3人（発達障害）連れて夜逃げ→不登校スタート→家庭内暴力→日々感謝子どもへの対応を変える→不登校収まり、平穏な毎日のありがたさを知る｜【自分の思い描く未来に前進】をモットーにサポートします|子育てお役立ち情報、発達障害、不登校、HSPたまにスピリチュアルなツイート","＼ おはようございます ／ 今日は、先負、月徳日万事支障がない日なのですが、午後が特に吉子どもが傷をつけた家の補修！火災保険の個人賠責で支払ってもらえることを最近知りました払いっぱなしで使う事ないと思っていたので、ほんとラッキー #おは戦50317mk ","4923 ","106","227","10"
"R91929l","@R91929l","R@陰陽師&情報空間研究家 @R91929l 『式神』で人生無敵化する情報を発信中|師匠から陰陽術を学び若くして起業&最愛の恋人ができる|『式神』の力によって月収300万・時間にも誰にも縛られない生活の実現・人脈が広がる（資産50億の人、フリーメイソン、某有名企業の役員、社長、etc...）|『式神』であなたのあらゆる願望を叶え人生無敵化します","明日また無料プレゼントをします。 前回の無料プレゼントはどちらかというと土台の話。明日の無料プレゼントは願望実現に最も役立つ秘伝の技「式神」の使い方についてです。 楽しみにしててください。","775 ","771","83","3"
"katuisisuki","@katuisisuki","かつ【多趣味・G党60年】終活中 @katuisisuki #砂金掘り #石拾い #路上観察  #看板  #飾り瓦  #ヒスイ #黒曜石  #水石  #蛍光鉱物 #山野草  #演歌 #歌謡曲 #昭和レトロ #寺社建築  #木造家屋 #火の見櫓  #木製電柱 #ラジオ サイレントリスナー  《磨かない原石派》 勧誘エロ系は即ブロック DMは見ません","おはようございます 3月20日（月曜日） 【コの字の街灯】  ①数年前に酒屋の側で見た街灯は オブジェのように異様な形 何故その形なのか『謎』 火の見櫓同様にいつの間にか消えて幻となってしまった （過去写真） レトロな感じの酒屋は今も健在  ②北海道にあるオブジェ  #街灯        #レトロ","1929 ","055","186","9"
"poikatsuitsuki","@poikatsuitsuki","itsuki　1日1歌人 @poikatsuitsuki フォロワー様に日々感謝のしがなき歌人。投稿から24時間以内に頂いたいいね返し90%(YouTube宣伝系、一部外国語系は敬遠気味)。善意無きDMは不要です。 1度も絡んだ事ないのに引用RTするのNG。 RT垢 @11RT13     p.s.たまに自作自演のバグツイート出現。","おはようございます。 3/19は　#ミュージックの日。今日は音楽の生まれる過程を人になぞらえ一首。  melodyは 言の葉と出逢い受胎する 祖母もマリアもひとひらに添い  case.その出逢いが奇跡の音を、あなたをこの世へ導いた。  #短歌","様に日々感謝のしがなき歌人。投稿から24時間以内に頂いたいいね返し90%(YouTube宣伝系、一部外国語系は敬遠気味)。善意無きDMは不要です。","573","282","36"
"minakichi_30","@minakichi_30","美七希 @minakichi_30 マンモスと旅する歴史好き女全国の寺社や日本の歴史を楽しく伝える人。1日にパンツを3回履き替えます。参拝記録??? #吉参拝","さあはじまるぜサタデーナイト！  歴史の創作ドラマを作っています。 https://vt.tiktok.com/ZS8VeDaYJ/ 卑弥呼として弥生時代を生き抜く 占い師の姉弟が登場します。  邪馬台国は、 一体どこにあったんだろうか","3014 ","730","59","6"
"Rena_Pooh_","@Rena_Pooh_","Rena @Rena_Pooh_ フリー演者 愛媛⇒東京の人?音楽企画?150cm⇒Poohお風呂*。お酒⇒エウレカ愛シンフォRE2Rena(ユニ)コーン｢｣推しマつけてくれたらリストいり#出会いに感謝 @07Pooh1  サブ垢。フォロバ少しずつやけん希望の方はリプ","ちなみに気合いのATMで 10万円おろしたけど 3000円しか使わんかったw 気合い大事やねww  そして大雨そりゃ頭痛すごいわ","2万 ","202","67","0"
"pupupooon","@pupupooon","? とも＠HEXA #NFT?+brain @pupupooon HEXA 公認アンバサダー   #HEXA NFT → http://onl.sc/xtnSkSZ brain販売中→http://citty.jp/pctennbai 物販（Amazon Yahoo! mercari)→brain","河里花的倒影，愿?的生活如一?繁花，永?美?，永?幸福！ The reflection of flowers in the river, may your life be like a tree with flowers, always beautiful and happy! #nature","3440 ","315","91","9"
"FVcamHcv6wZHtdv","@FVcamHcv6wZHtdv","めっちめっち平和と感謝と元気特殊鋼販売が日本を感謝で包みます @FVcamHcv6wZHtdv DOZAN11感謝神宮神社日本一隅を照らすレゲエ右へ1000キロ青森へ左に1000キロ鹿児島へ家族で思い出作り日本制覇２回目他では観れないＣ級な旅 子どもたちの未来に今考える父の言葉を残します　　　　　　　　　　　　　　　　　　　悩める老若男女皆様へ人生と仕事の楽しみ方提案中","初のNFTプロジェクト... あっという間に完売！！ 0.222ethというお安くないのが200枚... 感動した！！ 協力/Mintしてくれた皆さん！！ ありがとうございました！！ ジェネまで突っ走るぞ！！ ジェネAL欲しい人！！！ フォロー、RT、AL欲しい！と、リプ下さい！ メモっときます！","13000 ","220","45","5"
"mametaro1210","@mametaro1210","豆タロ～ @mametaro1210 こんにちはorこんばんはorおはようございますその時その時の…自身のココロの形状に添う写真を、毎日。話し下手なので、想いを写真に託して…。Twitterを通したビジネス等々のお話は、頑なにお断りさせていただきます…すみません","2日前のtweetとは対照的に、空は明るく…眼前は鮮やか。春霞越しの景色は…お気に入りの絵本で出逢う描写のように、どこかフワフワしていて、しなやかな球体が宙に浮いているよう。涙の膜を重ね、眼の奥に悲しみの層を造るような毎日が続いても…自分の中で“いろ”が戻る瞬間がある。それが…希望。#色","2319 ","931","213","13"
"MarikoKawana","@MarikoKawana","川奈まり子怪談@KawanaKwaidan @MarikoKawana 作家。YouTube「川奈怪談」の語り部。最新作は『一〇八怪談　濡女』。一〇八怪談シリーズ、実話奇譚シリーズ、『八王子怪談』『宵坂つくもの怪談帖』『東京をんな語り』 『でる場所』『迷家奇譚』など著書多数。怪異体験談のご応募やお問い合わせはDMで。日本推理作家協会会員。","【YouTube川奈怪談】3/21(火)18時公開のお話は【川奈怪談まとめ⑲】約1時間23分／「死の知らせ」「廃墟半島　軍艦マンション編」「廃墟半島　ホテル編」「彼岸トンネル」の計4本をお届けします。 https://youtu.be/OtaIGfL64SE  チャンネル登録をお願いします http://youtube.com/@KawanaKwaidan","2.2万 ","054","51","8"
"sinon1103","@sinon1103","紫暖（しのん） @sinon1103 占い師 紫暖です。占い歴13年目、占わせて頂いた人数1万人以上、鎌倉フォーチュン、SATORI電話占い、自宅サロン、手相、タロット、シータヒーリング、数秘術、四柱推命、アストロロジー☆カラー、占星術、カラーセラピー、レイキヒーリング、アクセスバーズ、画家","豊かさの定義とは 『やりたい事をやりたい時に出来ること』 『自己表現する事』  それを確信できたのは旅行の予約をするとその後、講座の申し込みがあり旅行分のお金が入ってくるの。やりたい事を許可すると豊かさが形となって現れるんだね感謝","3578 ","581","54","3"
"omochi20fire","@omochi20fire","おもち｜20代から始める余生 @omochi20fire 20代で5000万貯めたのでサイドFIREしました｜ホワイト企業リーマンに転職→空き時間に副業でSNS&ブログ→退職→まったり遊んだりたまに働いたりしてます","資産1000万までは約6年かかったけど、1000万から3000万は1年半で達成できた。やはり1000万以降はそれまでに身につけた「お金を稼ぐ力・運用する力・守る力・使う力」が掛け合わさって資産増加スピードが一気に早くなったので、1000万貯めれたら資産形成に必要なスキルのほぼ習得できる気がします。","18000 ","308","575","28"
"in_july2018","@in_july2018","こぐま学生 @in_july2018 寝ても覚めても朝ドラが好き。推しはハル婆ちゃんとか竹村夫妻とか。いつかエキストラ出演したい。リプへのお返事はほとんどできません (ある日突然沼に沈み、勢いで作ったスト垢 @chiseeeeeeee )","現役を引退したばんばの歩みに、同じく引退した笠やんを投入して物語を進めていくというのが巧いよねぇ #舞いあがれ","2978 ","117","936","31"
"emiry_oinari","@emiry_oinari","トレえみ@40kg痩せた人 @emiry_oinari 40kgの減量に成功した173cm|ダイエットレシピ書籍【トレえみDIET】https://amazon.co.jp/dp/4594090257","3月31日まで、LINE新規登録者限定で【40%OFF】のクーポンがでてるよ！  40%OFFクーポン→https://rs39.net/oic_series/support/emiry_oinari/lp/221125/…   #OIC #pr","389000 ","123","950","70"
"MABP_matsuo","@MABP_matsuo","松尾 直樹 | MABP代表取締役副社長 @MABP_matsuo (株)M&Aベストパートナーズ 代表取締役副社長｜証券会社⇒M&A仲介会社⇒2018年にMABP設立｜5期目｜製造×建設×不動産×ヘルスケア業界に特化｜独立思考が強い人が集まる会社｜社員55名超え｜箱根駅伝に2度出場｜営業･仕事･起業･経営･M&Aなどを発信｜フォローすると、ビジネススキルが上がります","成長や結果は継続から生まれる。そのためには『自分自身と向き合うこと』が大事。輝かしい経歴を持った人、結果を出している人と比べる必要はない。環境や経験値が違う。ライバルは自分。経営もビジネスもSNSも同じ。昨日の自分を超えるために「できる範囲を最大限に努力し続けること」が必要不可欠。","15000 ","643","438","20"
"apollo_iss","@apollo_iss","アポロ @apollo_iss 後悔しない選択をするコツをつぶやいてます｜○億で上場企業に会社売却｜テクノロジー大好き｜健康志向｜うまくいってる人の考え方｜#避けたほうがいいカラダに悪影響の原材料は、①外国産の遺伝子組み換え小麦 ②植物油脂 ③イーストフード ④乳化剤。おすすめはセブンイレブンの「北海道産小麦の金の生食パン」フォローうれしいです。","赤坂の料亭。30代美女と会食。会社売却のお祝い。個人資産10億円。家は港区のタワーマンション。車はマクラーレン。大成功した"" 秘訣 ""を直接聞いてみた。「 もちろん投資は大切。つみたてNISA、iDeCo、S&P500、ビットコイン....でも私が若者にかえれるなら100％やらないと後悔すること、それは.....↓","25000 ","373","698","128"
"tokumaru_mabp","@tokumaru_mabp","徳丸 祐也｜MABP執行役員 @tokumaru_mabp M&Aベストパートナーズ 執行役員｜医療・ヘルスケア業界をメインに建設・不動産・物流関係のM&A支援｜SMBC日興証券（新卒）→M&Aキャピタルパートナーズ→MABP（現職）｜一生に一度の究極の経営判断を全力でサポート｜熊本県出身｜九州をもっと盛り上げていきたい｜ビジネスに関することなどをツイートします。","営業はヒアリングが大事。『売れる営業マン＝話し上手』と言うイメージが先行しがちですが、実は『ヒアリング上手』であることが前提条件です。お客様のニーズを満たす提案には話す力より、「聞く力」「聞き出す力」「聞き取る力」の３つの力を鍛えることが大切。ヒアリングは結果に直結します。","269 ","054","425","13"
"gannbax","@gannbax","アツシ＠30代を自由に楽しく @gannbax 【誰かに話したくなるクスッと話やちょっとした雑学を発信】妻、娘、犬の4人家族の30代子育てパパ｜営業→制作会社→事業会社でWEBマーケに従事。副業スキル：web制作｜6:00にオリツイ発信中｜フォローすると『一緒にTwitterを楽しめ毎朝笑顔でスタート』ができます｜なにかあればお気軽にDMください","「んー…気になっちゃう！」休日のお昼。「全部オレにまかせて！」と家事も息子くんのお世話も、夫ががんばってくれている。疲れがたまって眠いので、お昼寝したい。だけど、気になっちゃう！遮光カーテンのスキマからもれる＂光＂。寝室のドアからもれる＂光＂。この＂光＂問題を解決してくれたのは→","2700 ","268","199","40"
"ByeByeKanrishok","@ByeByeKanrishok","とんかつ|ツイッター攻略の人 @ByeByeKanrishok 【Twitterでビジネスがつよくなる!？】|45才|宮城|マンガとイヌとネコ大好き|法人営業《2,000人中2位》｜店長《顧客満足2,400店舗中2位》|講師実績《1,000時間以上》|Twitter1年でフォロワー15,000人|月間240万インプ超|ディープなTwitter情報を発信中!!","今日が一番新しい未来、だから自信をもって進む。明日の事を考えると・・不安になったりするけどさ、できることをしっかりやる。よく考えると《未来は一日ずつしか来ない》から慌てる必要なんてないんだよね。まずは一歩一歩、確実に！あとちょっとでフォロワー16,000人、今日もしっかり前進しよう！","【Twitterでビジネスがつよくなる!？】|45才|宮城|マンガとイヌとネコ大好き|法人営業《2000人中2位》｜店長《顧客満足2400店舗中2位》|講師実績《1000時間以上》|Twitter1年で15000人|月間2400000インプ超|ディープなTwitter情報を発信中!!","808","754","246"
"musume_tamago","@musume_tamago","一途くん沼らせろ @musume_tamago 男の本音を呟いてます。沼るくらいなら沼らせて溺れさせろ。男を溺愛させて沼化させる方法など発信。","""付き合ってないよ？  でも貴方は 誰にも取られたくない存在なの。""","25000 ","682","991","145"
"7iroin5zuka","@7iroin5zuka","なないろ @7iroin5zuka 星組礼真琴さん＆せおなこみほさんをお慕い申し上げる大人。無言フォローさせてください＆フォローもお気軽にまだあやふやで勉強中なので全てが周回遅れです合言葉は推しは推せる時に推せたまにドット作る＆縫い物するかも金神垢(自我) @7iroin5","赤と黒初日カテコ琴ちゃん:WBCわたくしとした事がリアタイできませんでした…ダイジェストを色々漁りたいと思います…明日は決勝がありますねぇ!!ありちゃん!!!(←はいっ!!!と元気よくありちゃんお返事)明日から私たちはおフランスの住人となりますが…日本一丸となって頑張りたいと思います!!!","232 ","575","114","24"
"kaoru_lifehack","@kaoru_lifehack","かおる @kaoru_lifehack ストレスフリーな仕事術を発信 | 高専の技術コンテストで日本一 ? 大学院 & フリーランス ? IT企業 ? スタートアップ企業CTO | 『人は人、自分は自分。自分に集中する』","結果が出ない人の特徴⑩選? ? ①そもそもやっていない ②完璧をもとめる ③時間を無駄につかう ④いいわけばかり ⑤ストレスに弱い ⑥???1歩目が遅い ⑦感情のコントロールができない ⑧先延ばしして焦る ⑨プライドが高い ⑩結局やっていない  結果が出ない人には、プロフ最後の言葉も届けたい。","5895 ","330","474","78"
"mas_steps","@mas_steps","マス @mas_steps 初心者向けに「お金の知識」を発信。フォローすると「お金の余裕」が手に入り、人生が楽しく豊かになります。『マスブログ』を運営。40代サラリーマン。米国起業→どん底→本業/資産8桁。応援フォロー嬉しいです","人生に遅いなんてない。僕も40代から本気でお金の勉強を始めた。最初はわからないことばかり。NISA、ふるさと納税、医療費控除、確定申告、保険、公的年金、投資。誰にも聞けず心折れそうだった。それでも、学びながら行動したら最強の学問だと確信できた。歳なんて関係ない。一緒に学んでみませんか？","13000 ","983","744","129"
"wakayuka18","@wakayuka18","ゆかこ｜中高生子育ての落とし穴を呟く人 @wakayuka18 こじらせ母歴15年??間違いに気付く??見守る子育て??親子で人生激変！｜ゲームばっかりで勉強しない・受験生・不登校の見守り方｜中高生ママ中心のお悩み相談3600時間以上｜息子２人｜親子仲や夫婦仲が改善！子どもが意欲的になりました！高校・大学の合格報告も多数｜チョ～母親目線の「思春期子育てのコツ」を毎日ツイート","自分のアタマで考えて動く子の育て方「アドバイスはしない」「指示命令もしない」「失敗するかも…と感じても“させる勇気”を持つ」「子どもの立場に立って考えてみる」「やり方にこだわらない」「自分で何とかする力があると信じる」「俯瞰して見る習慣」「全ては最善という捉え方」「脱！心配症」","5684 ","613","267","20"
"momotro018","@momotro018","桃太郎+ @momotro018 小さな世論の力を集めて自公維国 財務カルト中抜き政権の鬼退治をしていきましょう  私たちに必要なのは『知識と怒り』だ。  泉房穂新党/れいわ/共産/社民 を応援しています #一揆 #政権交代 #消費税の嘘 #税は財源ではない #政府の赤字はみんなの黒字 #緊急事態条項反対 #自民党全員落選運動","消費税の納税の仕組みを出来るだけ噛み砕いて説明した図を作ってみました。鬼高額な社会保険料も相まって『正社員を減らして派遣に切り替えるほど利益が増える税』 まさに『雇用をブチ壊す税』だという認識が世間にもっと広まってくれ！！#消費税の真実 #STOPインボイス","23000 ","496","400","211"
"tackeyshisan","@tackeyshisan","たき｜会社員向け""片手間投資"" @tackeyshisan 【会社員がやる投資の1stステップ】35歳SE｜年収600万のブラック平社員→個人事業で1800万を消失、コロナで仕事凍結→未経験から1年半で資産5000万｜公式LINEで『コスパ最強投資術』の全てが分かります","年収500万以上でも、本腰を入れて投資する会社員は""失敗""します。自分をどれだけ優秀だと勘違いしてるか知らないけど、独学で投資するのはキケン。本当に価値ある情報は『資産家同士』で完結する。積み立てNISAやiDeCoだと不十分なこともわかってるなら、固ツイから次のステップに進もう。まだ間に合う","3143 ","257","746","776"
"takshi_77","@takshi_77","竹林 崇@脳卒中リハの専門家, 作業療法士, PhD（医学） @takshi_77 大阪公立大学| 教授| 博士（医学）|作業療法士（Occupational therapist）| 脳卒中後の手の麻痺のリハ開発| ロボット開発| 片手で使える道具（Assistive thecholgy）開発| 国内外医学論文多数| NHK等のメディア対応経験多数| 所属関係なく個人の意見| 漫画好き（推しの子推し）","納豆好きな方って多いですよね。でも、障がい等で片手が不自由な方は、うまく容器を固定できず、かき混ぜるのが難しいと伺います。そこで、作業療法士の友人が納豆容器を固定するための道具を作っています。人に頼まず、自分の好みのかき混ぜ具合を実現できます。必要な方に届いて欲しいです。","25000 ","669","978","191"
"Love_yellowhat","@Love_yellowhat","George @Love_yellowhat 教員. Work smarter than harder 質問箱：https://peing.net/ja/dr_george_osaru… note：http://note.com/dr_george_sens…","必修ではない授業でぼっちであることは、負けではなく勝ちなのです。","41000 ","378","742","607"
"shun_55fire","@shun_55fire","しゅん｜資産5000万公務員 @shun_55fire 【公務員がやるべき資産形成法を発信】 36歳｜副業禁止の公務員→資産形成開始→資産5000万到達｜不動産オーナー歴8年、株式投資歴10年｜ゼロからスタートする公務員の大富豪道はオレに聞け！","30代公務員は貯金するなよ！  節約して3万貯金しても年間36万。10年で360万。子供が大学に入学すれば一瞬で吹き飛ぶ。今はとにかく投資あるのみ。積み立てNISA、不動産投資、どれも公務員には向いている投資。預金より利回りがよく、数百万単位でまとまった金額を取得できる。方法は固ツイをチェック！","1207 ","419","836","849"
"atama_active","@atama_active","あたま┃瞑想でメンタル改善┃22年のうつ経験から逆転！ @atama_active 【100%嘘なし！私の人生逆転ストーリー】 高校でいじめ?22年間うつで苦しむ?1,000を超える科学的テク実践?マインドを変えてうつを克服?起業１年目で年商3,500万┃人工透析患者でも諦めない┃科学的メンタル術を発信┃あなたを１歩ずつ幸福マインドに！メンタル不安定な方が活躍する社会を創る社長","私は22年うつ病。身体障害者1級。友達0。彼女も0。やる気も0。テレビが取材に来ても良いレベルの【引きこもり生活】でも、科学的なライフハックで人生を変えられた！プロフ見てよ。瞑想や運動が答え。改善＆挑戦を続けただけ！人生変えたい人・変えてる人、間違いないです。一緒に成長しよう","8100 ","285","757","71"
