"omochi20fire","@omochi20fire","おもち｜20代から始める余生 @omochi20fire 20代で5000万貯めたのでサイドFIREしました｜ホワイト企業リーマンに転職→空き時間に副業でSNS&ブログ→退職→まったり遊んだりたまに働いたりしてます","新卒でブラック企業に入社して苦労したけど「絶対にFIREしてやる！」と思えたのであれはあれでいい経験になりました笑 でもこう振り返られるのは僕がたまたま今幸せに暮らせてるからなので「苦労は買ってでもしろ」なんて言えないし、次世代の人たちのためにもブラック企業は全て消滅して欲しいです。","1.8万 ","438","108","2"
"in_july2018","@in_july2018","こぐま学生 @in_july2018 寝ても覚めても朝ドラが好き。推しはハル婆ちゃんとか竹村夫妻とか。いつかエキストラ出演したい。リプへのお返事はほとんどできません (ある日突然沼に沈み、勢いで作ったスト垢 @chiseeeeeeee )","今のばんばにできること、今のばんばにしかできないこと。単にジャム作りなど生活上のことを考えてしまってたけどジャムを食べた歩ちゃんがあんなに愛おしい顔になってそれを見て舞達も皆笑顔になってそんな風に皆を幸せな気持ちにすることも今のばんばにしかできないことだなと思うと深い #舞いあがれ","2977 ","934","224","4"
"emiry_oinari","@emiry_oinari","トレえみ@40kg痩せた人 @emiry_oinari 40kgの減量に成功した173cm|ダイエットレシピ書籍【トレえみDIET】https://amazon.co.jp/dp/4594090257","速攻ウエストくびれ作りたい人はこれ。ベリっと剥がしてペタっとつけるだけでくびれさらに強調、肋骨締めも可能は優秀。ベルトは公式web限定で無料プレゼントでついてくるやつ 公式web http://bit.ly/3hDLb4r","38.8万 ","991","55","4"
"MABP_matsuo","@MABP_matsuo","松尾 直樹 | MABP代表取締役副社長 @MABP_matsuo (株)M&Aベストパートナーズ 代表取締役副社長｜証券会社⇒M&A仲介会社⇒2018年にMABP設立｜5期目｜製造×建設×不動産×ヘルスケア業界に特化｜独立思考が強い人が集まる会社｜社員55名超え｜箱根駅伝に2度出場｜営業･仕事･起業･経営･M&Aなどを発信｜フォローすると、ビジネススキルが上がります","成功すれば自分のせい、失敗すれば他人のせい。これは良くない。成功した時は周りに感謝、失敗すれば自分を進め方を振り返る。成功は1人の力ではない。周りや環境に感謝しよう。失敗は更に重要。失敗の原因は大抵自分にある。周りの巻き込み方や物事の進め方。失敗をコツコツ学ぶことで成功に近づく。","1.5万 ","622","15","4"
"apollo_iss","@apollo_iss","アポロ @apollo_iss 後悔しない選択をするコツをつぶやいてます｜○億で上場企業に会社売却｜テクノロジー大好き｜健康志向｜うまくいってる人の考え方｜#避けたほうがいいカラダに悪影響の原材料は、①外国産の遺伝子組み換え小麦 ②植物油脂 ③イーストフード ④乳化剤。おすすめはセブンイレブンの「北海道産小麦の金の生食パン」フォローうれしいです。","コーヒー×トーストがモーニングルーティンの父に即共有。","2.5万 ","573","2","1"
"tokumaru_mabp","@tokumaru_mabp","徳丸 祐也｜MABP執行役員 @tokumaru_mabp M&Aベストパートナーズ 執行役員｜医療・ヘルスケア業界をメインに建設・不動産・物流関係のM&A支援｜SMBC日興証券（新卒）→M&Aキャピタルパートナーズ→MABP（現職）｜一生に一度の究極の経営判断を全力でサポート｜熊本県出身｜九州をもっと盛り上げていきたい｜ビジネスに関することなどをツイートします。","営業は課題発見力を身に付ける。お客様の「課題=悩み」ではなく、「理想と現実の差を生み出す原因」を発見する。いま抱えている悩みに対して、悩みを生み出す原因を発見。更に潜在的な悩みを追究することも営業マンに求められる。課題発見には「ヒアリング」「コミュニケーション」が必需スキルです。","252 ","546","22","2"
"gannbax","@gannbax","アツシ＠30代を自由に楽しく @gannbax 【誰かに話したくなるクスッと話やちょっとした雑学を発信】妻、娘、犬の4人家族の30代子育てパパ｜営業→制作会社→事業会社でWEBマーケに従事。副業スキル：web制作｜6:00にオリツイ発信中｜フォローすると『一緒にTwitterを楽しめ毎朝笑顔でスタート』ができます｜なにかあればお気軽にDMください","今だったらバズってるはず。「ぜいたくは敵だ！」と戦時中にあった有名な標語。その標語にらくがきをした人がいて、敵の前にスを入れ、『ぜいたくはス敵だ！』にしてしまったという。いたんですね、戦時中にもバンクシーみたいなシャレ者が。","2699 ","868","181","57"
"ByeByeKanrishok","@ByeByeKanrishok","とんかつ|ツイッター攻略の人 @ByeByeKanrishok 【Twitterでビジネスがつよくなる!？】|45才|宮城|マンガとイヌとネコ大好き|法人営業《2,000人中2位》｜店長《顧客満足2,400店舗中2位》|講師実績《1,000時間以上》|Twitter1年でフォロワー15,000人|月間240万インプ超|ディープなTwitter情報を発信中!!","超キケン！消えるアカウントの特徴！ズバリ『交流が少ない』このままじゃフェードアウトにリーチ状態…だから、私のリプ欄を利用して欲しい！頑張る仲間がモリモリいるし、めっちゃ優しい人が多いと思わない？つながってみんなで頑張ったら継続できると思う。さぁ【勇気を出してリプ】して見よう！↓↓","【Twitterでビジネスがつよくなる!？】|45才|宮城|マンガとイヌとネコ大好き|法人営業《2000人中2位》｜店長《顧客満足2400店舗中2位》|講師実績《1000時間以上》|Twitter1年で15000人|月間240万インプ超|ディープなTwitter情報を発信中!!","350","689","216"
"musume_tamago","@musume_tamago","一途くん沼らせろ @musume_tamago 男の本音を呟いてます。沼るくらいなら沼らせて溺れさせろ。男を溺愛させて沼化させる方法など発信。","なんでいつも絶対に叶わない ような恋ばっかしてるんだろ","2.5万 ","343","126","14"
"7iroin5zuka","@7iroin5zuka","なないろ @7iroin5zuka 星組礼真琴さん＆せおなこみほさんをお慕い申し上げる大人。無言フォローさせてください＆フォローもお気軽にまだあやふやで勉強中なので全てが周回遅れです合言葉は推しは推せる時に推せたまにドット作る＆縫い物するかも金神垢(自我) @7iroin5","応天の予習を始めました。BJれいこさんの「馬鹿が…(超絶呆れ(クソデカ溜息)」みたいな雰囲気が、根っこはめちゃ良い人なので結局放っておけず巻き込まれるところまで含めて、なんかれいこさんに合っててとても好きなんですけど、漫画読んだ感じそんな雰囲気がするのでとても楽しみ","232 ","236","1","0"
"kaoru_lifehack","@kaoru_lifehack","かおる @kaoru_lifehack ストレスフリーな仕事術を発信 | 高専の技術コンテストで日本一 ? 大学院 & フリーランス ? IT企業 ? スタートアップ企業CTO | 『自分の機嫌を自分で取る』","ストレスフリーな働き方  ・すぐやる ・人に頼る ・自分を褒める ・疲れる前に休む ・敵はつくらない ・会社に期待しない ・いい人は演じない ・人は人、自分は自分 ・複数の収入源をつくる ・職場以外のコミュニティをもつ  ストレスフリーな生き方はプロフ最後に残してあります。","5861 ","707","95","48"
"mas_steps","@mas_steps","マス @mas_steps 初心者向けに「お金の知識」を発信。フォローすると「お金の余裕」が手に入り、人生が楽しく豊かになります。『マスブログ』を運営。40代サラリーマン。米国起業→どん底→本業/資産8桁。応援フォロー嬉しいです","やり方次第！今を変えたいなら行動しかない！","1.3万 ","378","1","1"
"wakayuka18","@wakayuka18","ゆかこ｜中高生子育ての落とし穴を呟く人 @wakayuka18 こじらせ母歴15年??間違いに気付く??見守る子育て??親子で人生激変！｜ゲームばっかりで勉強しない・受験生・不登校の見守り方｜中高生ママ中心のお悩み相談3600時間以上｜息子２人｜親子仲や夫婦仲が改善！子どもが意欲的になりました！高校・大学の合格報告も多数｜チョ～母親目線の「思春期子育てのコツ」を毎日ツイート","俺も気をつけないといかんね。。","5679 ","106","1","1"
"momotro018","@momotro018","桃太郎+ @momotro018 小さな世論の力を集めて自公維国 財務カルト中抜き政権の鬼退治をしていきましょう  私たちに必要なのは『知識と怒り』だ。  泉房穂新党/れいわ/共産/社民 を応援しています #一揆 #政権交代 #消費税の嘘 #税は財源ではない #政府の赤字はみんなの黒字 #緊急事態条項反対 #自民党全員落選運動","岸信千世氏 (31歳) が事務所開き「父、伯父の思いを背負って」山口2区  あの安倍元首相ですら、秘書官を4年経験して39歳で立候補だぞ。山口県民はよく考えて欲しい『こんなんでも受かるから笑いが止まらんわｗ』って馬鹿にされてるんだぞ？  記事 https://asahi.com/articles/ASR3M578HR3MTZNB001.html… ","2.3万 ","902","57","20"
"tackeyshisan","@tackeyshisan","たき｜会社員向け""片手間投資"" @tackeyshisan 【会社員がやる投資の1stステップ】35歳SE｜年収600万のブラック平社員→個人事業で1800万を消失、コロナで仕事凍結→未経験から1年半で資産5000万｜公式LINEで『コスパ最強投資術』の全てが分かります","25歳以上45歳未満の人は必見  すぐにでも8桁の資産をもてる可能性がある。このことを知らない人が多すぎる。『不動産投資』はお金持ちだけがやるものだと思い込んでいるなら間違いですよ。今は「キャリアを資産に変える時代」。実は初期費用0円で貯金無しでも始められます。秘訣は固ツイをクリック。","3141 ","4","0","0"
"takshi_77","@takshi_77","竹林 崇@脳卒中リハの専門家, 作業療法士, PhD（医学） @takshi_77 大阪公立大学| 教授| 博士（医学）|作業療法士（Occupational therapist）| 脳卒中後の手の麻痺のリハ開発| ロボット開発| 片手で使える道具（Assistive thecholgy）開発| 国内外医学論文多数| NHK等のメディア対応経験多数| 所属関係なく個人の意見| 漫画好き（推しの子推し）","今日は6時半から校門の前に並び、息子の卒業式の最前席を獲得。プライベートと仕事もしっかり準備をして後悔なく時間を過ごしたい。これが自分が大事にしていることです。良い時間を過ごしたいと思います。","2.5万 ","325","45","2"
"Love_yellowhat","@Love_yellowhat","George @Love_yellowhat 教員. Work smarter than harder 質問箱：https://peing.net/ja/dr_george_osaru… note：http://note.com/dr_george_sens…","付き合い方を考えている時点で友人ではないです。   #Peing #質問箱","4.1万 ","110","377","26"
"shun_55fire","@shun_55fire","しゅん｜資産5000万公務員 @shun_55fire 【公務員がやるべき資産形成法を発信】 36歳｜副業禁止の公務員→資産形成開始→資産5000万到達｜不動産オーナー歴8年、株式投資歴10年｜ゼロからスタートする公務員の大富豪道はオレに聞け！","悲しすぎる公務員人生  毎晩22時まで働いて、節約しまくって、めでたく子供は大学に進学。老後は年金だけでは足りないから、65歳になっても節約生活。気が付けば『節約人生』なんてことも…。嫌なら今すぐ固ツイの事を始めよう。公務員なら結果はプロフの通り出せます。お金に困らない人生を作ろう。","1204 ","161","809","823"
"atama_active","@atama_active","あたま┃瞑想でメンタル改善┃22年のうつ経験から逆転！ @atama_active 【100%嘘なし！私の人生逆転ストーリー】 高校でいじめ?22年間うつで苦しむ?1,000を超える科学的テク実践?マインドを変えてうつを克服?起業１年目で年商3,500万┃人工透析患者でも諦めない┃科学的メンタル術を発信┃あなたを１歩ずつ幸福マインドに！メンタル不安定な方が活躍する社会を創る社長","寒暖差でメンタル落ち込みました。そんな時は「リカバリーの方法を試すチャンス」。あたまは??  ・映画 ・ヨガ＆瞑想 ・焚火で焼肉 ・60分筋トレ×? ・新しい店で店員と話す ・小さなボランティア活動  で回復できた！楽しい行動はメンタルに＋10pt P.S.リプが返せなかった方、ごめんなさいm(__)m","8091 ","090","97","17"
"Happygooood2944","@Happygooood2944","彩福 @Happygooood2944 彩色屋／社寺荘厳／工房より生中継／伝統産業の涙／和風でSorry ! Painter/Decoration for Shrines&Temples/Live from our factory/Tears in the traditional handiwork-world/Very Japanese !","  熱闘！唐子園  エース月曜  日曜日と祝日の中継ぎ登板  勝ち負けのお彼岸 春告マウンド  休みたい気持ちを牽制 平日の意地を見せろ！","2730 ","011","125","6"
"craftsman207","@craftsman207","企むオトコ @craftsman207 オトコソロ活動中。 ひとり法人代表。　　　　　　　　　　　　　　　　　　　　　　　料理は、作って楽しみ、目でも楽しむ 旅、からだ、健康、仮想通貨を企む 量子力学と色即是空。 すべては内から始まる。 利他と自責のこころ。 世の中にラブとユーモア、そして浪漫を。本日より、DMは親しい方のみ","飽きもせず企む。  気持ちのよいお天気。 も少し気温が上がれば 春本番  鰤かま焼き。 3日目は お手製調味液につけてたのを フライパンで何とか焼く 厚揚げの味噌汁。  もう1回分 鰤があるなあ～。 さあて何を作ろうか？  美味しゅうございました  #おうちごはん #鰤かま #ストウブ #料理好き","3884 ","901","238","6"
"noborutakachi","@noborutakachi","高知東生 @noborutakachi 高知東生です。今自分に出来ること…。自分に向き合い、日々を綴っています。YouTubeたかりこチャンネルhttps://youtu.be/rj96-LCcLJI 応援して下さい。自叙伝「生き直す」刊行しました。  ※お仕事の問い合わせはinfo@scga.jpまで","努力と自己責任論だけでは問題解決に至らない。けれど相談された時につい「あきらめずに頑張れ」なんて言ってしまうのは自分の中に答えがないから。逮捕前の俺がそうだった。人って相談事を金や力のありそうな人にしがちだけどピンチの時はピンチを経験した人、助けられた経験のある人にした方がいいゾ","6.1万 ","372","567","118"
"alpha_movie01","@alpha_movie01","ALPHAスナフキンのひとりごと Snufkin's tweet for your life @alpha_movie01 スナフキンと一緒に優しい時間の繋がりで、優しい世界を作ろう！☆音楽垢 @alpha_music01 ☆壁紙垢 @alpha_thankyou ☆支援垢 @sky_supporting も宜しく☆Why don't you take a journey of imagination with Snufkin?  #フォロバ100%","【自作＋お勧めスマホ壁紙紹介】 Free wallpapers you can take free.  いろいろ難しい世の中だけど たまには心のサングラス外して 本当の自分を解放してみようじゃないか  ＜今日の壁紙＞230320-1 ・壁紙は自由にお使い下さい ・iPhone、android　1080x1920 (9:16) ・個人利用のみ","8482 ","749","162","16"
"usao_recipes","@usao_recipes","うさお -恋愛相談- @usao_recipes 大失恋が人を魅力的に変えてくれる。恋愛相談、復縁相談の人。 600人以上の復縁成功者を見届けてきました。 累計2000件超の電話相談→ https://fukuen-recipes.com/advice/6813 サブ垢→  @usao_sub  質問箱用垢→  @usamonbako","『冷却期間』って言葉がしっくりこないなら 『受け身期間』に変えてみるといいかもね。  ■受け身期間■ ・能動的に関わろうとはしない。 ・向こうからのアクションで関わる場合や、どうしても関わる必要がある場合はわざわざ素っ気なくしたりしないで心の余裕を意識して好意的に対応。","5998 ","580","123","22"
"ituki3hu","@ituki3hu","恋愛,復縁占い師＊桜井一姫 @ituki3hu 恋愛占いを無料でしてます/ 応募方法は固ツイに / 今までに700名以上の相談経験 / タロット占い師として複数の場所で活動中 / 有名ヒーラーに教わりヒーリング技術も取得","3/16 彼の夜の気持ち  ↓彼の星座↓ 牡羊：隣で寝たい 牡牛：キスしたい 双子：手つなご？ 蟹：電話したい 獅子：ハグしたい 乙女：ご飯いきたい 天秤：好き 蠍：束縛したい 射手：浮気しないで 山羊：触れたい 水瓶：ずっと一緒 魚：会いたい  【フォロー＆RT】であなたの思いが伝わる","1891 ","927","351","97"
"hukuen_hanairo","@hukuen_hanairo","はないろ｜復縁婚しました @hukuen_hanairo 遠距離・彼の他好き・婚約破棄で別れ→冷却期間後、連絡しつつタイミングを待つ→別れて1年半後に復縁→1年後に結婚→現在結婚10周年｜実体験から復縁結婚に必要だった学び・心構え・してよかったコトをつぶやいてます｜より深い話はブログやnoteで発信中 →「復縁結婚のコツ　はないろ」で検索してね?","復縁のために頑張ってる人ってめっちゃ一途だし、別れの原因に向き合ったり自分磨きに励んだり、人間的に成熟した人が多いと思う。復縁は相手とのタイミングもあるから絶対とは言えないけれど、みんな絶対【幸せ】はその手につかめるから…今の頑張りはぜーんぶ絶対、無駄にはならないからね","2052 ","711","19","1"
"meruken_suck","エラー","エラー","エラー","エラー","エラー","エラー","エラー"
"Rei_Kyogoku","アカウントエラー","アカウントエラー","アカウントエラー","アカウントエラー","アカウントエラー","アカウントエラー","アカウントエラー"
"Spicaspiritual","@Spicaspiritual","スピカ｜霊視鑑定士 @Spicaspiritual 現役霊能者。10,000件以上の鑑定実績あり。 縁結び、霊視・オーラ占い。","たくさん反応いただきありがとうございます こちらは抽選になります！ 連日行なっている無料鑑定は変わらず続けますが、無料での『個人鑑定』は最初で最後です。 4000フォロワー様達成したらまたお知らせいたします","3808 ","702","115","7"
"hiroshi03692","@hiroshi03692","京都ぶらりhiroshi0369 @hiroshi03692 大好きな京都の魅力を発信。 神社仏閣や観光スポット、京都旅の魅力を京都ぶらりブログで情報発信しています！厳選した商品を提供。楽天RoomOpenしました。是非お立ち寄りください！","春探しへ円山公園へ 枝下桜が咲き始めました。 少し早かったのですが… 現在、三分咲き程度。 #京都ぶらり #イマソラ #京都観光 #円山公園 #枝下桜","4507 ","178","35","2"
"GoshuinTouring","@GoshuinTouring","御朱印ツーリング会（神社仏閣オートバイ巡り） @GoshuinTouring 神社仏閣へﾊﾞｲｸでGo! 中部支部(ﾚﾃﾞｨｰｽ)関東支部(男女)のｵｰﾄﾊﾞｲﾂｰﾘﾝｸﾞ会です,詳細はWebへ.【走行ｽﾋﾟｰﾄﾞ+15km/h以内】【参拝作法を他人に押し付けない】をﾓｯﾄｰに活動.40～60代男女,岐阜/三重/愛知/滋賀周辺,神奈川/東京/埼玉周辺の会","2023年3月16日(木)中部支部 Part1 レディース早春の三重ツーリング [三重県]桑名宗社(春日神社) #御朱印ツーリング #御朱印巡り #バイク女子 #レディースライダー #桑名宗社 #春日神社","1261 ","880","185","10"
"Tau_okA","@Tau_okA","多摩美術大学オカルト研究会 @Tau_okA 【新入生募集中。DMください。】霊感のないマグルでも大丈夫です。ホラー映画/心霊スポット/エスパー開発/特殊ホラーメイク/ホラーゲーム/映像撮影/ホラードール蒐集/UMA/宗教/怪談/タルパ/明晰夢開発/何でも歓迎   入部希望の方はDMまでご連絡下さい","お二人の独特な掛け合いがクセになるイベントでした！","1458 ","866","2","1"
"central_field_","@central_field_","中野友加里☆社長歴10年 @central_field_ バイトか社長しかやったことがありません/TikTok22万フォロワー/著書ベストセラー/販売日本一で地球にあるものすべて売れます/都市伝説BARオーナー @BarKamna /守護霊といっしょに人に憑いてるものは追い出しながら心霊写真たくさん撮って10万人から届く願いごとを叶える日常を #うしろの中野さん でマンガ連載中☆","【中野さん超☆開運イベント】  一粒万倍日×寅の日×天赦日 が重なる最強開運日に 中野さんが運気UPいたします☆彡  ★3月21(祝)★ 15:00～24:00開催  当日限定 ・中野さん開運メニュー ・開運お守り※数量限定  ※憑いてる場合は厄祓いいたします","バイトか社長しかやったことがありません/TikTok22万/著書ベストセラー/販売日本一で地球にあるものすべて売れます/都市伝説BARオーナー","676","221","43"
"lovemedo_yogen","@lovemedo_yogen","【公式】Love Me Doの大予言＠タロット一枚引きでお返事きます。 @lovemedo_yogen 「ラブちゃん、占って」と話しかけると、今のあなたへ1枚引きのタロットで返信します。 占い師 Love Me Do 公式占いサイトのTwitterです。 芸能人の結婚時期など的中実績多数 ・開運日と新月、満月のお知らせ ・最新無料占いをどこよりも早くお知らせ ・そのほか先生の開運情報を発信 #lovemedo #Doさん","おはようございます。本日は大安です。古い言葉で言えば「大いに安し」という意味があり「1日中、何をするにも吉」とされています。本日もいい日になりますように","2626 ","968","444","17"
"SUN082319","@SUN082319","こーへい 心のセルフケアコーチ @SUN082319 【自己否定を手放して幸せな人生へ】人生どん底正社員メンタル崩壊「自分の心」を一番大切にするmasaさん、おかぴーさんを引き寄せる心の仕組みを200万円かけて学ぶ""幸せと自分軸と自由""を手にする方法を無料メルマガで特別公開中|""ご縁ある方の一生の味方""","おはようございます！  『結局、最後はうまくいく』  この言霊を唱えてみてください。  いままでもそうだったように  結局、最後はなんとかなります！  絶対大丈夫です！！！  安心してくださいね","3566 ","019","396","38"
"kub81pre","@kub81pre","くぼ｜Appleの 背が大きい人 @kub81pre 【人生を楽しむ秘訣】Twitterをリアルに繋げるフットワーク│ 友達0人11か月で250人リアル交流│人生を少し変える│刺さる画像リプ で 大喜利│月間インプ6600万(単月)│Amazonアソシエイト参加│#パワスポ開運 × AppleWatch#リプ欄に。フォローして待ってて→","【お知らせ】 来月4/28（金）東京にて再び平野井シェフとコラボ肉会開催しますはじめましての方も大歓迎！ご参加希望の方はDMもしくはリプください。","2781 ","713","97","19"
"TChan831","@TChan831","Momo-chan @TChan831 猫とピアノと文学、お酒が好き（禁酒中）。料理は毎日。元ボクサー（目を傷め、プロは断念）。モットーは、適度にテキトー。3社で勤務後、現在フリーランスの翻訳チェッカー。料理や猫、音楽などを中心に雑多な由無し言を呟きます。  なお署名つきのツイートは飼い猫のももちゃんが勝手にしたもの   ぜひお気軽にフォローを","おはようございます  朝食は、#えびアボカドトースト。アンチエイジングに抜かりなし。#老化はみんなYEAR  明け方、両親の部屋からももちゃんのイビキが聞こえ。 生きとるんだよナと実感し、妙に感傷的に……。  さあ、お空も真っ青の好天であります  皆さま、良き月曜日にいたしませう","1万 ","195","443","10"
