"lovemedo_yogen","@lovemedo_yogen","【公式】Love Me Doの大予言＠タロット一枚引きでお返事きます。 @lovemedo_yogen 「ラブちゃん、占って」と話しかけると、今のあなたへ1枚引きのタロットで返信します。 占い師 Love Me Do 公式占いサイトのTwitterです。 芸能人の結婚時期など的中実績多数 ・開運日と新月、満月のお知らせ ・最新無料占いをどこよりも早くお知らせ ・そのほか先生の開運情報を発信 #lovemedo #Doさん","らぶちゃん、トレンド入ってるでぇ","2999 ","108","980","1181"
"SUN082319","@SUN082319","こーへい 心のセルフケアコーチ @SUN082319 【自己否定を手放して幸せな人生へ】人生どん底正社員メンタル崩壊「自分の心」を一番大切にするmasaさん、おかぴーさんを引き寄せる心の仕組みを200万円かけて学ぶ""幸せと自分軸と自由""を手にする方法を無料メルマガで特別公開中|""ご縁ある方の一生の味方""","【天赦日×一粒万倍日×寅の日】  おはようございます！  3月21日春分の日の今日は…  今年最大の最強開運日です  最強開運日から奇跡を起こすために  ""今年1番の奇跡が起きる""  この言霊を唱えてみてください。  最強開運日に言葉を大切にすると とんでもない奇跡が本当に起こります","3588 ","091","653","69"
"kub81pre","@kub81pre","くぼ｜Appleの 背が大きい人 @kub81pre 【人生を楽しむ秘訣】Twitterをリアルに繋げるフットワーク│ 友達0人11か月で250人リアル交流│人生を少し変える│刺さる画像リプ で 大喜利│月間インプ6600万(単月)│Amazonアソシエイト参加│#パワスポ開運 × AppleWatch#今日は一粒万倍日。フォローしてリプ欄書くの待ってて→","超最高。仕事で見れてないけど。WBC & タッキーtobe & Apple Watch 優勝","2794 ","315","3","2"
"TChan831","@TChan831","Momo-chan @TChan831 猫とピアノと文学、お酒が好き（禁酒中）。料理は毎日。元ボクサー（目を傷め、プロは断念）。モットーは、適度にテキトー。3社で勤務後、現在フリーランスの翻訳チェッカー。料理や猫、音楽などを中心に雑多な由無し言を呟きます。なお署名つきのツイートは飼い猫のももちゃんが勝手にしたもの    ぜひお気軽にフォローを","#牛丼（当家風。糸コン、焼き豆腐入り。他のお客様の丼には手を出さないで下さい） #ザ・日本食  わたくしの得意料理、第13位でございます（2021年、ビデオリサーチ調べ）。  では、いただきます  ※とろ火から弱火で #自分に負けないで","1万 ","166","814","22"
"mimishiao388","@mimishiao388","あお耳もみ/耳診断 @mimishiao388 【耳ってスゴイ!を発信】3ヶ月でﾌｫﾛﾜｰさん1.1万人｜耳ﾌｪﾁ×耳ﾏﾆｱ×耳ｵﾀｸ｜耳ﾘﾌﾚｸｿﾛｼﾞｰ専門家｜耳施術3万人超｜よくのびる柔らかい耳が自慢｜??#耳でアナタの性格も本質も丸見えです｜ﾌｫﾛｰうれしいです♪","福耳（ふくみみ）って知ってる？｢耳たぶ」が大きくふっくら 肉厚で、上に ""米粒"" が乗るくらい 上を向いて 受けているのが 最強に良い形。代表的なのは【 浅田真央さん 】お金のめぐりがよく長く 豊かな生活が送れる。また性格が「温厚」で「面倒見」が良くて周りの人に 感謝され助けてもらいやすい","1.1万 ","331","90","27"
"koumeiofficial","@koumeiofficial","辛口コウメイ男性心理に詳しい占い師×波動鑑定ヒーラー @koumeiofficial 2022年は約1万人を占う | 女性ではわかりにくい男心を詳しく、辛口占いでアドバイス | あなたが抱える未来への不安を占いと波動調整で抹消| 女性の恋愛（彼氏欲しい、彼と付き合いたい、復縁）、旦那・子供との関係・仕事（転職、副業、起業）の相談が得意中の得意 | #占い　#個人鑑定　#恋愛相談","なぜあなたがクソ男しか見つからないのか  →","6813 ","462","9","3"
"tamerunnn","@tamerunnn","ためるん @tamerunnn 【お金の知識をわかりやすく発信】凡人な主婦でも月7ケタ┃1年半でTwitter5万名┃パワハラ上司に悩まされ副業を本業に┃今は会社をやめて自由に働いてます。フォロワーすると40代主婦にもできたフリーランスの歩み方がわかります。","人生一度きり。本気で変わりたければ、捨てることから始めましょう。「3時間のスマホ依存」「Netflix3時間」「4時間睡眠」「ムダな飲み会に3万円」空いた時間とお金で「10分の読書」「2時間の副業」「7時間の睡眠」「毎月3万円のつみたてNISA」。そんなのムリという人には、リプ欄のことばを届けたい。","【お金の知識をわかりやすく発信】凡人な主婦でも月7ケタ┃1年半でTwitter5万名┃パワハラ上司に悩まされ副業を本業に┃今は会社をやめて自由に働いてます。すると40代主婦にもできたフリーランスの歩み方がわかります。","-","369","248"
"asagiribotan24","@asagiribotan24","金運を動かす人朝霧牡丹 @asagiribotan24 動かなくなった金運を動かす人/数十万円単位でお金に縁があった報告アリ/タロット占いも出来る/2児のパパ ご依頼はDM","金運ブースト改受けてくれた人から、イベント満員御礼のお知らせが(?´?；?ω?；?｀?)  いやー、嬉しいかぎりです(?´?；?ω?；?｀?)","3823 ","90","7","0"
"hiyokoharumaki","@hiyokoharumaki","ヒヨコ【ポムポムサニー】 @hiyokoharumaki 2005年生まれの息子ハルマキ君は重度に近い中度知的障害を伴う自閉症・てんかんで、支援学校高等部。リアルの仕事は保育士ですが地域を回ることが業務の不思議な立場。ポムポム言います。ピアノとバイオリン弾き。PECS/国境無き猫もふ団/スイーツマネージャー/ポムポムプリン似/ツイ廃","今の小学校はこんなことないと思いたい… 出来れば中学校もこんなことないと思いたい…","7473 ","336","8","0"
"ringo19770","@ringo19770","リンゴ＠発達障害児ママ @ringo19770 【ADHD9歳息子のママ】突然病気で夫を亡くし発達障害３歳の息子を抱えてシングルマザーに｜息子のために副業を開始｜現在はフリーランス｜自己肯定感UP｜勉強しても通用しない知識じゃなく、リアルなドタバタ子育て理論発信｜子育て中ママも、自宅でビジネスが叶う｜#頑張り過ぎないことご相談はリンク先へフォロー大歓迎","失敗した時は受け入れることが大切。 前に進むために失敗はつきものだね @ringo19770","3973 ","55","3","1"
"monkiti_smile","@monkiti_smile","もんきち┃出版社の人 @monkiti_smile 自分らしさを活かした商品作り・売り方のコツを発信｜出版社販売部門トップ｜コンテンツ企画・マーケティングのプロ｜僕をフォローして一緒に”あなたらしさ”を見つけて、魅力のある商品づくりを考えていきましょう。","僕は大勢が苦手。でも、人は大好き。そんな自分としっかり向き合いたくて、幹事をしたり、会に参加したり、スペースをしてる。沢山辛いこと、悲しいこと、失敗を経験してきたけれど、それ以上に大切なものを手に入れることができていると感じている。ちょっとずつ、""自分らしさ""が見えてきた。","↓数に悩む人に向けて書いたnoteですnote.com/monkichi_ao/n/…2021年11月からTwitterを利用しています","913","91","10"
"kurumimru","@kurumimru","胡桃丸 ゆるゆるゆるりと行きますね @kurumimru もっといろいろ勉強したい！しあわせ求めて日々精進中！気にしない流されない…そんな感じかな(^^)法務、ライティングetc…。blogは日々の思いを綴っています。さわやかな田舎暮らし7年目みなさんよろしくお願いします♪( ´▽｀)","おはようございます¨?  自分にあるものを大切に。無いものねだりばかりだと疲れちゃうよ。人と比べる必要はないの。自分自身に気持ちを向けよう。目をとじて朝の新鮮な空気を胸いっぱいに吸い込んで~ゆっく~り吐ききろう。顔を斜め上に向けてゆっくり目を開ける…どんな感じかな？¨?  #おは戦50320mg","2911 ","262","261","11"
"do_reboot","@do_reboot","りぶ @do_reboot メンタルダウンからの立ち直り方｜２度の うつ病で どん底→40代で人生好転→人生を楽しむ “折れない心” を入手｜接客業16年で磨いた対人スキル｜フォローで『心を整えるコツ』が身につきます｜","メンタル疾患の人に知ってほしい【砂糖をやめると体に起こるヤバい変化】?圧倒的に若返り、見た目が良くなる?身体中の炎症が減って、謎の不調が消えていき、体調が良くなる?圧倒的に疲れ温くなる?メンタルが安定する。シュガーハイは自分を苦しめるので、やめて圧倒的に元気になっていきましょう。","4367 ","076","87","28"
"yossi02121","@yossi02121","yossi0212 @yossi02121 うすらぼんやり生きてます 休日にゆるく写真を撮ってます","まだ見ぬ絶景を求めて歩き回りました #tokyocameraclub","2231 ","938","90","14"
"mii_neko48X","@mii_neko48X","みぃねこ。服で悩みを解決する人。 @mii_neko48X ファッションであなたの悩みを解決します┃モテたい。結婚したい。子が自慢のパパママに。営業成績UP。全てファッションで解決┃元トップ営業マン＆中小病院経営者の秘書┃現在はファッションスタイリストとして活動。14ヶ月連続でご依頼続出中！┃お客様の幸せが何より嬉しい┃口コミには感謝","仙人。私の中で幾人かいます。その中の1人は落合陽一さん。 @ochyai  初めての出会いは子どもの教育セミナー。お話が高速回転で大変面白かった。しかも壇上でお話されている中、携帯でたまに作業されている所に新しさを感じた。2つのコトを同時にやる・時間を惜しみなく使いたい私と近い考え方かも↓","5941 ","379","79","5"
"riemann_golf","@riemann_golf","タクミ｜ゴルフコーチング @riemann_golf 【ゴルフ上達や人生の役に立つ情報を毎朝６時に発信中】お金も時間もスキルも無い100ギリできないダメ会社員（28歳）""好き""で人生を変える??ティーチング資格取得→レッスン開始（36歳）｜ 会社員の僕だからこそ、寄り添えることがある。気になる限定情報は公式のLINEから僕をフォローして一緒に学びましょう","人は言ってることよりやってること、行動を見てその人を判断します。「本当は行きたかった..」行きたいなら来ればいい。「もう少し時間があれば..」そんな人は時間があってもやらない。「本気だしてないだけ..」出さない理由は。動いてなんぼ。行動することがスタートライン。口ではなく背中で語ろ。","1450 ","652","92","16"
"denchi_bouchou","@denchi_bouchou","じゅん｜仕事の悩み相談人 @denchi_bouchou 【仕事に悩んだら、まず俺に聞け！】仕事が出来ない・つまらない・やりがいが見つからないを『面白い・楽しい』にします！平社員から代表取締役になった【出世のプロ】が仕事の楽しみ方、考え方を伝えます！｜つまらないを面白いに！いつでもDM相談のりまっせ！｜得意：IT、営業、障害福祉、就職・転職｜弱点：堀内健｜じゅんじゅわ～","決して甘くするなって話ではないけど、甘いことと優しいことの区別ができる人がオレは好き。","3858 ","666","98","3"
"takumi920_","@takumi920_","たくみ｜陰キャラ男子のあがり症対策 @takumi920_ 【緊張で頭が真っ白になる】を克服した隠キャラ男子｜フォローすると本番に強くなる考え方が身につく｜24歳｜非HSS型 #HSP｜緊張しすぎて体が震える人必見！#あがり症 の克服方法を発信｜自信をつけ自分らしく生きる！｜散歩と読書。甘味も捨てがたい...","変わりたい理由と変わるための行動の積み重ねで人は変わることができます","1532 ","60","2","1"
"yPy3KUeGIpXkwkC","@yPy3KUeGIpXkwkC","チャイ @yPy3KUeGIpXkwkC 非モテであっても魅力を高めて最短でモテる男になるための知識、マインドを公開します。登録者限定プレゼントをゲットできる公式LINEはこちら→https://lin.ee/Z5EHu5A","【無料プレゼント】  【マッチングアプリ完全攻略】を無料でプレゼント。これ読めばアプリで可愛い彼女は簡単に作れる。アプリで悩む人は是非。2万字超え。  【参加条件】 ・フォロー ・いいね&RT ・『欲しい』とリプ ・公式LINEに登録後に「アプリ大全」とだけ入力  https://lin.ee/Z5EHu5A","2.7万 ","573","696","132"
"nakamoto_saki","@nakamoto_saki","さき| 幸せ育てるカウンセラー @nakamoto_saki 【自分が大事と思えるマインドセットを発信】カウンセリングルームプロペラ代表|NLPトレーナー、精神保健福祉士、心理カウンセラー|家族との関係、愛着障害で悩んだ過去|自分の気持ちにフタをしがちなあなたの力に|カウンセリング歴8年｜リプまたはDMで気軽にご相談ください。","「家庭はあたたかくて安心できるところ」、それをあまり実感できずにお母さんになったとき、こそだてに緊張がともなうことが多いと言われています。 この方もそうでした。","547 ","059","87","13"
"yukiyuki_kiryu","@yukiyuki_kiryu","桐生由紀/Authense/代表社労士/ベンチャー・IPO支援/社外役員/男の子3人ハイキャリママ @yukiyuki_kiryu スタートアップベンチャー支援/人事顧問/IPO支援/女性社外役員/Authense社労士法人代表 兼 法律事務所ボードメンバー/元専業主婦・シングルマザー→ベンチャー再就職→管理部長・人事部長キャリア14年/男3人ハイキャリママ/家庭や育児を理由に「自分の人生やキャリアを諦めない」日経xwomanアンバサダー","おはようありがとう今日は4月からの復職者向けの「育休後カフェ」。復職予定のメンバーと人事、上司、先輩ママが集まって、復職後の仕事の仕方や両立の秘訣などをディスカッションする機会。復職後、最初の1年はなかなかハード。でも周りのサポートがあるかないかで大きな違いが出る良い一日を","6777 ","549","9","1"
"ma510_happier","@ma510_happier","なおと|寄り添い自分軸コーチ（社労士×メンタル・キャリア） @ma510_happier ♪ いつからでも自分軸でイキイキ♪/20年超のメンタル不調を一気に解決した覚醒をトータルサポート/メンタル(ACT療法)社会保障.自己理解.やりたいこと.副業起業支援/北野→京都大→大手安定IT職で撃沈→安定起業/個人向け社労士/NPO活動も/歌とDQW好き/https://lit.link/ma510happier","〈やりたいことがない？〉 自信がなくてやりたいことがなかった昔の私。長年の会社員生活が自分軸を忘れさせていました。子供の頃は？入社した頃は？思い返せばやりたいことを自然と諦めていたかもですよ。本当のなりたい自分を呼び起こさせる自己理解はオススメです","8679 ","975","90","7"
"Ojukenpapa2021","@Ojukenpapa2021","補欠の上 @Ojukenpapa2021 お子が小学校受験を終え、余生をすごしているアカウント。共働き激務の悲哀、教育、美味しいご飯、あたりをつぶやくことが多いはずです。","やはり来世は地主！  地主が「AIに奪われない職で良かった」と言っているのを目撃しすごい感情に襲われてしまった「土地は永遠…」「階級の固定化が進むのか」","1841 ","822","9","0"
"yoshino_3773","@yoshino_3773","よしの@怒りを言語化し笑顔の日常へ @yoshino_3773 【自分の本当の気持ちを言語化しよう】 怒りと上手に付き合うことが自信への一歩/他者の怒りに敏感で毎日不安な日々を送る/自分と向き合い想いを言語化/感情コントロールできるようになり心軽やかに/怒りを知り笑顔いっぱいの日常を一緒に目指しませんか","肩に力が入りすぎていませんか？物事をやる時に意気込むこともあると思いますが、肩に力が入りすぎると本来の力を発揮することができなくイライラしてしまうことも人はリラックスしている時にが最も力を発揮しやすいです。力を抜きながら力が出せるよう深呼吸することが大切ですね","1923 ","497","94","9"
"Tokusuke4","@Tokusuke4","とく@心穏やかに生きる @Tokusuke4 【幸せは気付きから】心穏やかに強く生きる思考法を発信 | フォローすると「人生の幸福度」が上がります | 超ブラック建設業界から転職３回でGAFAの管理職へ | 固ツイは人生をかけた夢 |フォロー励みになります。","知りたい？配色に悩んでいるフォロワーさん、my family にだけ教えちゃう。デザイン制作の配色に悩んでいたら動画のツールを使ってみて。特に最後のツールはジェリーのおすすめ。","2661 ","905","83","57"
"zousanwarai","@zousanwarai","ぞう塾長 @zousanwarai 『継続アカデミー』塾長 ｜42歳｜#誰にとっても今が1番若いやるなら今｜継続が苦手な人に継続の「コツ」を伝えます｜継続の良さを毎日6:00に発信｜今話題の誰もやらなかった９人執筆note「春～もう人間関係で悩まない～」｜次回""夏""リリース決定｜お仕事、お悩みはDMへ｜「今日、例のnote割引価格です」固ツイ","【継続を覚えるとこうなる】  ①人より上手くなる  ②得意が増える  ③副業にできる  ④心が安定する  ⑤長い目で物事を見ることが 　できるようになる  ⑥継続すること自体がスキルで 　あることに気がつく  ⑦継続できない人に 　コツを教えることができる  1番のメリットはプロフです。","1.9万 ","131","584","124"
"Tatsunon09","アカウントエラー","アカウントエラー","アカウントエラー","アカウントエラー","アカウントエラー","アカウントエラー","アカウントエラー"
"tutiyak","@tutiyak","土屋幸太郎＠土屋薬局｜子宝漢方と痛みしびれ耳鳴り @tutiyak 薬剤師・不妊カウンセラー。未病を防ぐ、季節に応じた食養生、薬膳、ツボ、中医学の漢方養生、心の持ち方。健康のヒントを呟きます。土屋薬局の子宝相談では妊娠出産1028件(2004~2022年)私自身４２歳で結婚して52歳で念願の子宝、パパになれた経験を活かして薬剤師の妻と一緒に店頭で相談にあたっています。","主人は1週間以上、毎日のように首肩の激痛に苦しんでいましたが、漢方を飲んだ翌日には劇的に痛みが改善し、今では痛みが治まったようです。 おかげで、MRIを撮らずに済みました。  私も子どもの体操教室で痛めた膝が、3日位服用した辺りから、痛みが軽くなり、すっかり痛みがなくなりました！","6.5万 ","741","9","1"
"klilyn02241","@klilyn02241","浅川 英明|人生が変わる心理学 @klilyn02241 自己肯定感がアガる方法を発信/カウンセリング実績50名以上、110件|3,000件のクレーム対応→鬱病→ベストセラー作家の山根洋士氏に師事→自己肯定感を取り戻す→人間関係が楽に→スキな仕事で月収2倍/メンタルノイズ心理学協会カウンセラー×心理学でラクに痩せるダイエット講座主催|家族大好き|週1","あなたは「ダイエットは頑張らないと痩せない」と思ったこと、もしくは教わったこと、ありませんか？   答えはノーです。   「潜在意識」を使えば、頑張らなくてもドンドン痩せていきます。  その方法は、3月28日。 80分オーバーの動画で完全公開。  どうぞご期待ください！  詳細はリプ欄からどうぞ↓","647 ","566","73","37"
"BiwakoOfunato","@BiwakoOfunato","琵琶湖から大船渡 @BiwakoOfunato 演歌歌手さん応援してます 神社仏閣巡りが好き 大沢桃子さん山内惠介さん真田ナオキさん山下智久さん 神社朱印帖８冊目 ㍻28年2月から地元神社総代 西国三十三所札所会 大先達 満願6回 西国33観音 四国88 新西国33　秩父34 近畿不動尊 将棋五段 温泉旅行 ドライブ カラオケ ガーデニング ?mebaブログ見てね！","【#棋王戦】勝利で #藤井聡太 竜王が #史上最年少 ６冠！ おめでとうございます 公式棋戦も合わせ10冠の快挙！ タイトル戦13連勝 残るは名人位と王座","4623 ","887","98","4"
"nurse_ma_ma","アカウントエラー","アカウントエラー","アカウントエラー","アカウントエラー","アカウントエラー","アカウントエラー","アカウントエラー"
"Totsukebi1228","@Totsukebi1228","ひーちゃん @Totsukebi1228 初御朱印川越氷川神社で頂きすっかりハマり中寺社巡り大好き。 パンダ 野球プロレス観戦も。 最近は畑と花にも興味あり友達とのかわいいのを見つけに探索も。","フォロワーさんのえみさんより ( @mitarokun0227  ) 素敵便が届きました 己書とチューリップのキーホルダー キーホルダーの中ペーパークイリング 手作り めちゃくちゃ可愛い 己書にもチューリップ  突然だったからびっくりしました。 ありがとうございました 庭のも咲いてます。","1060 ","35","5","0"
"hayanoshin_n","@hayanoshin_n","はや 強運マーケティング @hayanoshin_n 【私の投稿から学べます】?強運になるマーケティング?実践して成果の出た強運副業術?SNSマーケ?Webビジネス全般?開運マインドフルネス・ファスティング■商品企画実績400アイテム■工場指導180社■セッション80件以上■ 強運note限定無料プレゼント https://bit.ly/3qnZdLF","やっぱり！大谷翔平選手は、『運』の考え方がスゴイ。花巻東高１年のとき、佐々木監督の教えによって、作成した「目的達成シート」。その目標を達成するために必要なこととして「運」だと明確に書いています。そして、ビッグスターになった今も続ける開運の秘訣があります。その運を引き寄せる方法は『","1944 ","147","92","51"
"lemon_omai","@lemon_omai","まひで @lemon_omai で神社お寺/御朱印/稀に御城印 山梨のほったらかし温泉とみたまの湯がお気に入り 御朱印と気付けばアイスのツイートばかりです 月詣り 阿佐ヶ谷神明宮/高円寺氷川神社・気象神社/高木神社/沼袋氷川神社/下谷神社／渋谷氷川神社 投資/副業/宇宙人/エロ/スピリチュアルはブロックDMは","今まで野球興味なかったけど 今回は大谷さん影響で少し見てたら 最後の最後　興奮した(*´?`*ﾉﾉﾞﾊﾟﾁﾊﾟﾁ  日本凄い 最強  おめでとう(??????)  世界一まであと一歩  #がんばれニッポン  #WBC  #野球　#世界一　#頑張れ日本","1421 ","084","81","2"
"2019strawberry","@2019strawberry","strawberry @2019strawberry 2017年(平成29年)６月、鎌倉で御朱印に出会ってから御朱印巡りを楽しんでいます(*^^*)  美味しいものやお出かけの記録も…  ご縁を大切に  無言フォロー失礼します*_ _)ﾍﾟｺﾘ?","東郷寺  2023.3.20.  東京都府中市東郷寺さん  こちらの枝垂れ桜は身延山久遠寺さんから苗をいただき植樹されたものだそうです  満開の桜の花びらが風でひらひらと舞う様子がまた素敵でした","586 ","699","86","0"
"takieisuzu","@takieisuzu","いすず＠占い師 @takieisuzu 全国の悩みをスッキリ！お客様のハートに覚悟を与える霊視。悩まなくなる考え方を伝えてます。『開運いすずサロン』代表。神道天行居三代目道士。函館碧血会役員。北海道函館市人見町5-49 にて実店舗経営。占いは完全予約制。店舗での対面占いと電話占い両方受付中。","あまりに酷い入稿スケジュールで、YouTubeライブしたい！","4238 ","477","6","0"
