"ma510_happier","@ma510_happier","なおと|寄り添い自分軸コーチ（社労士×メンタル・キャリア） @ma510_happier ♪ いつからでも自分軸でイキイキ♪/20年超のメンタル不調を一気に解決した覚醒をトータルサポート/メンタル(ACT療法)社会保障.自己理解.やりたいこと.副業起業支援/北野→京都大→大手安定IT職で撃沈→安定起業/個人向け社労士/NPO活動も/歌とDQW好き/https://lit.link/ma510happier",". 〈人生に集中しよう〉 素敵な自分になりたい方、嫌な思考だけに時間を使うのは良く無い。悩むだけ、不安になるだけは負の連鎖です。悩むのではなく考えること、自分を認めてあげて行動してみることがあなたの人生です！幸せは妄想だけの中にはありません  #おは戦50320mg ","8689 ","1464","178","17"
"Ojukenpapa2021","アカウントエラー","アカウントエラー","アカウントエラー","アカウントエラー","アカウントエラー","アカウントエラー","アカウントエラー"
"yoshino_3773","@yoshino_3773","よしの@怒りを言語化し笑顔の日常へ @yoshino_3773 【自分の本当の気持ちを言語化しよう】 怒りと上手に付き合うことが自信への一歩/他者の怒りに敏感で毎日不安な日々を送る/自分と向き合い想いを言語化/感情コントロールできるようになり心軽やかに/怒りを知り笑顔いっぱいの日常を一緒に目指しませんか","おはようございます 夕べはのんびりと過ごされる 時間にスペースに参加して頂き 本当にありがとうございました 後悔から生まれる学びを得て 多くの優しさを与える これからの毎日を 優しさでいっぱいにして頂けると嬉しいです 今日も頑張ってね","1924 ","2062","399","33"
"Tokusuke4","アカウントエラー","アカウントエラー","アカウントエラー","アカウントエラー","アカウントエラー","アカウントエラー","アカウントエラー"
"BiwakoOfunato","@BiwakoOfunato","琵琶湖から大船渡 @BiwakoOfunato 演歌歌手さん応援してます 神社仏閣巡りが好き 大沢桃子さん山内惠介さん真田ナオキさん山下智久さん 神社朱印帖８冊目 ㍻28年2月から地元神社総代 西国三十三所札所会 大先達 満願6回 西国33観音 四国88 新西国33　秩父34 近畿不動尊 将棋五段 温泉旅行 ドライブ カラオケ ガーデニング ?mebaブログ見てね！","琵琶湖大橋から彦根市方面へ車を走らせました SNS で話題の人気スポット #あのベンチ に行ってきました #琵琶湖 #伊吹山","4625 ","1267","204","6"
"nurse_ma_ma","アカウントエラー","アカウントエラー","アカウントエラー","アカウントエラー","アカウントエラー","アカウントエラー","アカウントエラー"
"Totsukebi1228","@Totsukebi1228","ひーちゃん @Totsukebi1228 初御朱印川越氷川神社で頂きすっかりハマり中寺社巡り大好き。 パンダ 野球プロレス観戦も。 最近は畑と花にも興味あり友達とのかわいいのを見つけに探索も。","九重神社  埼玉県川口市 5.3.19 桜亀甲の御朱印 この日は子の日だったのでさんの 置きみくじを頂きました。 こちらのおきみくじはの模様が スタジイは相変わらず元気 パワーを頂きます","1059 ","366","71","3"
"hayanoshin_n","@hayanoshin_n","はや 強運マーケティング @hayanoshin_n 【私の投稿から学べます】?強運になるマーケティング?実践して成果の出た強運副業術?SNSマーケ?Webビジネス全般?開運マインドフルネス・ファスティング■商品企画実績400アイテム■工場指導180社■セッション80件以上■ 強運note限定無料プレゼント https://bit.ly/3qnZdLF","聞いてください。今日3/16は、一粒万倍日です。思考停止でぼっ～と過ごしてたらダメ。新しい物事をスタートさせましょ。何したらわからない人に開運アクション5選?財布の購入・使い始め?銀行口座・証券口座の開設?開店・開業?宝くじの購入?『　』これが一番大切です。それは...","1945 ","3802","120","51"
"lemon_omai","@lemon_omai","まひで @lemon_omai で神社お寺/御朱印/稀に御城印 山梨のほったらかし温泉とみたまの湯がお気に入り 御朱印と気付けばアイスのツイートばかりです 月詣り 阿佐ヶ谷神明宮/高円寺氷川神社・気象神社/高木神社/沼袋氷川神社/下谷神社／渋谷氷川神社 投資/副業/宇宙人/エロ/スピリチュアルはブロックDMは","髪の毛はこうして剃ります スケキヨ","1423 ","3434","161","38"
"2019strawberry","アカウントエラー","アカウントエラー","アカウントエラー","アカウントエラー","アカウントエラー","アカウントエラー","アカウントエラー"
"takieisuzu","アカウントエラー","アカウントエラー","アカウントエラー","アカウントエラー","アカウントエラー","アカウントエラー","アカウントエラー"
"yuki10558716","@yuki10558716","侑紀 @yuki10558716 介護のお仕事してます。知的障害を伴う自閉症の息子と、一人前の美容師になるため上京した娘の母です。  空を眺める事と神社仏閣廻り、占い好きです。","逢いたくて逢いたくて♪♪ 毎年 白木蘭が咲くと口ずさむ 『木蘭の涙』は名曲だなぁ。。。  還暦卯辰会梅上げの日 還暦の厄祓いで献梅する行事の ようです(? ?? ? ?? )  毎年2本づつ梅の木が増えてるそう  息子と良いタイミングで開運散歩??  今日も1日お疲れ様でした?*.ﾟ","1267 ","746","118","2"
"Tomo_Tomo1105","アカウントエラー","アカウントエラー","アカウントエラー","アカウントエラー","アカウントエラー","アカウントエラー","アカウントエラー"
"Go55F","@Go55F","Ks（≧∇≦） @Go55F お出かけ大好き（≧∇≦） 今しかない人生、どー生きるか？楽しくでしょがモットーです? 御朱印.美術館.博物館巡り?好きな･･･モネ.沖縄.観劇.簡単な刺繍.陶器?BTS.TXT.セブチ.エナプ.＆TEAM.めめ?人生豊かになりたいお年頃(ﾉ≧?≦)☆","ENHYPENのJAY×優里による「ドライフラワー」コラボレーションカバー映像が公開 https://billboard-japan.com/d_news/detail/123089…","261 ","318655","16147","6647"
"tamae3_love","@tamae3_love","たまえ生きる道しるべ @tamae3_love 心肺停止したからわかった命。笑顔で死ぬためにあなたらしく才能や魅力を発揮し健康に生きるお手伝い|元体育教諭･呼吸法･瞑想･心理学･中医学･aroma･color･暦|教え子はJrOlympic|信州産|ｼﾞｬﾆｦﾀﾊｲｷｶﾞｲ","人生のあいうえお。たまえ。 名言やーー！  1年後の未来の自分にも名言届けましょー #タイムカプセル祭 でツイートするしかないっすね 今日から毎日深夜にスペースやりながら3月25日の祭りの説明していきますー。お時間あったら顔だして下さい～！","5721 ","382","34","6"
"__sk012","@__sk012","うい @__sk012 元復縁垢","ご報告です。 話し合った結果、別れて約9ヶ月経ちましたが復縁しました","1637 ","-","1961","67"
"nami_hukuen","@nami_hukuen","なみ@復縁 @nami_hukuen 2年付き合って結婚寸前だったのに振られました/ 絶対に彼を引き寄せて復縁してみせます / 身近に復縁した方が多く、その方から頂いた言葉や体験、私の考えをツイート","よし、彼に会ってくる。 復縁を望むようなことなんて今日はしないけど、ただ楽しんでくる。  昨日のツイートへのいいねやコメントですごく勇気が出ました。 すごく不安だったけど、復縁垢の皆様のおかげで気持ちが楽になりました。 ありがとうございます  じゃあ行ってきます！","2935 ","28548","503","0"
"kazuya_uranai","@kazuya_uranai","カズヤ@縁結び占い師 @kazuya_uranai 《恋愛における悩みを解決し、幸せな未来へと導くアドバイザー》恋愛にお悩みの方へ！20～50代まで幅広くコンサル実績有り/対面鑑定実績700名以上/「片想い→交際」「別れて音信不通→復縁」「泥沼恋愛→幸せな家庭」/ 恋愛の主役になるコツを伝授！絶対に後悔しないで欲しい。本気で幸せになりたい方はnote読んでね","3/21 彼の気持ち占い  牡羊かまって 牡牛好きだ 双子一人にさせない 蟹座届け 獅子元気かな 乙女必要な時間 天秤笑顔好き 蠍座我慢できない 射手好きかも 山羊ハグして 水瓶独占したい 魚座なでなでする  《フォロー&RT》で彼から突然のアプローチがあるかも","329 ","4465","296","101"
"fukukun_renai","アカウントエラー","アカウントエラー","アカウントエラー","アカウントエラー","アカウントエラー","アカウントエラー","アカウントエラー"
"r_renaiya2","@r_renaiya2","復縁のろむ兄 @r_renaiya2 彼に追われて復縁を迫られる方法を呟きます。? ? ? ? ?大失恋して鬱病→恋愛心理学を猛勉強→復縁に成功","【3月15日の復縁キーワード】 彼の気持ちを知ろう。  一緒にいたいと思える いつまでも でも、時間は残酷だね  このツイートに「好き」とリプで 彼と復縁できるように 念を込めた。","241 ","592","17","3"
"numa_kare","アカウントエラー","アカウントエラー","アカウントエラー","アカウントエラー","アカウントエラー","アカウントエラー","アカウントエラー"
"yuuten_hosimizu","アカウントエラー","アカウントエラー","アカウントエラー","アカウントエラー","アカウントエラー","アカウントエラー","アカウントエラー"
"bentenbenten18","@bentenbenten18","おもちパン @bentenbenten18 2022年8月～復縁垢2023年3月～婚活垢双極性障害II型美術館で働いています","この半年間、さんざん悲しんで苦しんできた。もうこれ以上わたしはわたしを苦しませたくない。迷ったらそのことを基準にしよう。","2074 ","4352","42","2"
"fk_tap01","@fk_tap01","まる。 @fk_tap01 97(25)日常をゆったり呟いてます","@_zzZ_815   いねちゃんいいねありがとう 記念日おめでとう いつもいいねしてくれるしもっと話したいなって思ってるよ??","704 ","66","1","0"
"sucosucosamurai","@sucosucosamurai","夫すこすこサムライ @sucosucosamurai 傷つかないで幸せになれるわけないのよ人生のリベンジ備忘録俺の人生は冠婚葬祭の婚に全振り～","私は母から「アルバイトするならケーキ屋さんとかお花屋さんとかにしなさい。機嫌のいい人しか買いにこないから」って言われてデパ地下の精肉売り場でバイトした。ちょっと高い肉買いに来る人、みんな品がいいし機嫌いい。","4422 ","19675309","332381","66466"
"reishi_uranai","@reishi_uranai","レイ | 引き寄せ研究家 @reishi_uranai 引き寄せで”人生の抜け道”を発信。テレビやメディアにも出演経験有。ツイート見たら「」で入信。あなたは幸せになれる。","このツイートを見かけた方に金運が爆上がりして臨時収入が舞い込む兆しです  受け取る方はコメントで「」と送ってください","1668 ","6307","146","18"
"hp_je5","@hp_je5","あいり@自己肯定感を上げて復縁を引き寄せる占い師 @hp_je5 依存恋愛復縁占い師｜彼を追わせて依存させるを伝授｜男性を洗脳して依存させるのが大得意です｜毎日彼との運命を占います｜脳科学引き寄せの法則で彼を沼らせ、復縁し、彼に追われる人生へ導かせます｜フォローすれば恋愛、お金、仕事、全ての悩みが解決します","【3月21日復縁占い】  今日の彼の気持ちだよ↓  牡羊：安心する 牡牛：今じゃ無い 双子：絶対に 蟹：1人が良い 獅子：嬉しい 乙女：ダメかも 天秤：好きかも 蠍：君が本命 射手：もう無理 山羊：自由にしたい 水瓶：進む 魚：届ける  このツイートをRT＆いいねで 復縁出来る可能性アップ","2093 ","3377","166","54"
"EDqd9x","@EDqd9x","とわくん @EDqd9x センシティブな内容が含まれる可能性のあるツイッターです 夜職探されてる方 他のSNSはこちら↓","男って女の子に比べて 自分のことイケてると思って 自撮りあげるブス多くて笑えるね","13000 ","8044","127","7"
"hukuen_urani","アカウントエラー","アカウントエラー","アカウントエラー","アカウントエラー","アカウントエラー","アカウントエラー","アカウントエラー"
"na0829kn","@na0829kn","なな@復縁しました @na0829kn 復縁プロポーズされ結婚何事もポジティブが大事！元ネガティブでかなりのメンヘラだったアラサー女でございます ※相談はDMにて受け付けてますが返信遅くなります","くわばたりえさんが『旦那と付き合ってた時に１回別れていっぱい泣いて辛かったけど数年後に復縁して結婚した。別れて辛かった時に彼と結婚してこうしたいって考えてた未来を今叶えてると思うと嬉しくて泣けてくる』って泣きながら話してるのを今聞いてこっちまで泣けた、やっぱり辛い事には意味がある","2931 ","33983","800","66"
"kaito_uranaipro","@kaito_uranaipro","カイト復縁成就の占い師（フジテレビ出演/有名人とコラボ/各種メディア掲載経験あり） @kaito_uranaipro 進まない復縁を成就へ導くプロ｜復縁にお悩みの方へ｜占い会社ランク1位当たりすぎてフジテレビ出演｜「LINEブロック→結婚」「音信不通→付き合う」「片思い→付き合う」｜復縁運がグッと高まるコツを呟きます｜ライン登録で??復縁成功マニュアル（配信）を無料プレゼント→ http://lin.ee/p2SEHZk","3月20日 あの人の気持ち占い  牡羊束縛したい 牡牛前向きに 双子待ってるのに 蟹　涙が出た 獅子余裕を持つ 乙女冷めないで 天秤臆病な日 蠍　嫌えない 射手撫でたい 山羊戸惑う日 水瓶我儘になる 魚　恋は続いてる  フォローいいねRTで 恋愛運100%","1306 ","3115","167","42"
"ichiyoU8277","@ichiyoU8277","ichi-yoU @ichiyoU8277 いつも RT・いいね 心から感謝です  スピリチュアルTarot   数秘術＋独自法 龍体?龍踊文字にて   改善導き 龍神風水 貴方の不安  悩み 迷い   心が丸くなるまで  寄り添い 導くお手伝いをしています。気になる方は  友達登録をポチット https://lin.ee/WW14Wv0","こんにちは このツイートを見て下さった貴方へ  貴方の大切な人を大きな愛情で包んであげて下さい。お相手は今、少しだけ自信をなくしている様です。貴方から手を差し伸べ、寄り添ってあげて下さいね。  お互いに寄り添う事で、仲もより深まっていきますよ","1119 ","545","79","14"
"shiryu_hijiri","@shiryu_hijiri","聖(ヒジリ)1000人以上のご縁を結んだ恋愛占い師 @shiryu_hijiri 《 絶対に諦めたくない恋愛を成就へ導きます 》フォローするだけであなたと彼は両思いに強力な縁結びで500名以上の方を恋愛成就へ導く「困難な片思い?両思いになって交際」「音信不通?突然の連絡?復縁」「不倫関係?生涯のパートナーに」などの実績あり恋愛成就して幸せになりたい方は【公式LINE】にご登録ください","3/19彼の本音占い  あなたの星座 牡羊熱い想い 牡牛今行く 双子運命 蟹　導いて 獅子君を見ている 乙女信じてる 天秤つらい 蠍　ときめき 射手愛に溺れる 山羊じっとしてて 水瓶待ってる 魚　泣きたくなる  【フォロー＆RT】で恋愛運急上昇","309 ","2863","243","76"
"gosyuinaka","@gosyuinaka","御朱印好きのアカウント @gosyuinaka 京都を中心に行ったことのある色々なお寺や神社、お城の御朱印・御城印を載せるアカウントです。 参拝日がツイートした日と異なることはあります。","[出雲大社] “えんむすび”の“縁”は男女の縁だけではなく、生きとし生けるものが共に豊かに栄えていくための貴い結びつきだそう。作法は2礼4拍手1礼と他と違う。 #出雲大社 #出雲市 #出雲 #出雲観光 #因幡の白兎 #縁結び #御朱印 #御朱印巡り #御朱印集め #神社 #神社巡り","4314 ","-","254","5"
"kaede_hinomaruj","@kaede_hinomaruj","やまと楓 @kaede_hinomaruj 神社仏閣･御朱印･温泉･旅 etc…大好き趣味全開なアカウントです！ 関東中心に御朱印巡りしてます #神社仏閣 #御朱印 #パワースポット / 無言フォローすみませんぜひ気軽にフォローお願いします","御朱印旅 お疲れ様です(^^)  創建から2000年以上！埼玉県久喜市に鎮座する“関東最古の大社”【鷲宮神社】。  嘉永5年（1852年）造立の“魔除けの狛犬”＆安政7年（1860年）建立の“拝殿”など見所盛り沢山  人気アニメ「らき☆すた」の聖地としても大人気です  #御朱印 #神社 #パワースポット","2347 ","1653","207","7"
"jinjyajoshi","@jinjyajoshi","神社仏閣大好き女子 @jinjyajoshi 日本中の神社やお寺を旅してます。 まだまだ勉強中で知らない事だらけなので物知りさんを尊敬してます。","雨もあがってポカポカ陽気だったからお天気の神さまにあいさつしてきました 手水もサクラになっていて綺麗でした そろそろお花見もしたいなぁ","783 ","6920","422","7"
"kJAREIvq8onHbVg","@kJAREIvq8onHbVg","海瑠本好きなくいしんぼう・神社仏閣・怪談も好きいつもありがとうございます @kJAREIvq8onHbVg 好き(読書/怪談/動物/神社仏閣巡り)を詰め込むOLの日常リラックマになりたい札幌出身無言フォロー失礼します・フォロバゆっくりめ・タイムライン見れませんお返し遅れ気味たべものツイート  #海瑠のくいしんぼう日記 散歩ツイート  #海瑠さんぽ読んだ本  #海瑠のほんだな DM","#秘密は日記に隠すもの #永井するみ #読了  日常生活を送る上で 抱いてしまう人間の怖い部分を集めたようなアンソロジー  さりげなく次の作品に繋がる人物達が登場するようです  おばけや心霊現象より 実害を及ぼす生きた人間のが怖い...とはよく言ったものですよね...  じわじわくる作品(ΦωΦ)ﾌﾌﾌ…","2596 ","343","104","5"
"takagijinjya","@takagijinjya","高木神社 @takagijinjya 応仁2年（1468年）、室町時代の創祀と伝えられており、旧寺島新田の鎮守として尊崇され、古くは「第六天社」と呼ばれていました。明治時代初期の「神仏分離の制度」で『高木神社』と改め、その社名は、御祭神である高皇産靈神の別名が「高木の神」であるからといわれています。令和5年に御鎮座555年を迎えました。","かわいいおむすびくん  #高木神社 #墨田 #曳舟 #押上 #スカイツリー #おむすび #神社 #御朱印 #神社仏閣 #パワースポット #むすび石 #おむすび印 #紫社殿 #御鎮座555年","11000 ","4499","288","30"
"clarizel_pangan","アカウントエラー","アカウントエラー","アカウントエラー","アカウントエラー","アカウントエラー","アカウントエラー","アカウントエラー"
"isanotabi","@isanotabi","一三の旅 -いさのたび- @isanotabi 一三の旅公式アカウントです。 日本全国の神社仏閣・パワースポットを回り各地にいらっしゃる神々のお許しを得て力を授かる旅をしています。 旅の模様はYouTubeやInstagramでも発信しておりますので宜しかったらフォロー・チャンネル登録お願い致します。皆様の応援が励みとなります。 #一三の旅　で検索してみてください。","「一に焼山(焼山寺)、二にお鶴(鶴林寺)、三に太龍(太龍寺)」と言われる阿波の三難所のひとつで、標高600mの太竜寺山の山頂にあり、西の高野とも称されています。 #一三の旅 #巡礼 #神社めぐり #お寺めぐり #神社仏閣 #パワースポット #四国八十八ヶ所霊場 #太龍寺 #徳島県 #納経 #御朱印 #西の高野","857 ","1168","175","9"
"SipYuki","アカウントエラー","アカウントエラー","アカウントエラー","アカウントエラー","アカウントエラー","アカウントエラー","アカウントエラー"
"otoutan_ototan","@otoutan_ototan","たもっ @otoutan_ototan 「ツイてる」は魔法の言葉 気ままにのんびり呟きますツイてるツイてる／画像はいらすとやさんの作品を中心にお借りしています","おはようございます もしも どんな悩みも忘れさせてくれたり もしも どんな苦しみからも救ってくれたり もしも どんな心の痛みもやわらげてくれたり もしも どんな悲しみからも救ってくれる 魔法の言葉があるとすれば 私はこの言葉が思い浮かびます その言葉は   「ありがとう」 #ツイてる","9768 ","924","191","15"
"mayatokikuni","@mayatokikuni","世界はオカルト @mayatokikuni 口汚く人をののしる人間は覚悟してコメントを。ツイート全て関連しています。訂正あればお教えください。ﾂｲｰﾄが嫌ならｽﾙｰ願います。時差の為、日本の夜中、早朝にツイート多い。携帯を無音をお勧め。写真つきのツイートは早めに削除します。","日本語でなんて言うのかわからないけど、日本の大切な伝統芸の一つですね。","16000 ","6429","109","23"
"occult_love","@occult_love","Rei@オカルトブロガー&オカルト研究家 @occult_love オカルト全般が大好きです 日本全国500ヶ所以上の心霊スポットを巡り、事故物件に住み、怪談師の育成やお化け屋敷オーナーをしています ブログと旅アカ( @love_occult )もよろしくお願いします！ #オカルト #心霊 #都市伝説 #怪談 #ホラー #お化け屋敷 #廃墟 仕事依頼はDMから","京都怪談 猿の聲 7月29日(金)に発売されたこちらの怪談本を書かせて頂きました(?????)","47000 ","-","946","271"
"nanaka_shun","@nanaka_shun","奈々加 瞬 (ななか しゅん) @nanaka_shun 瞬女優／東京都出身/JACK AND SALLY CINEMA/ 女子だけで運営している""JUNK GIRLS""映像番組やってます/お仕事依頼→東京都中野区野方5丁目28-7 同洋ビル第二 4階/info@enjya.site 動画毎日投稿⇒朝:予言関係/夜:夢関係/その他怖い話・怪談・プラモデル・スピリチュアル等","毎晩みる夢の中では…。楽しい事が多いかな","2285 ","36958","149","32"
"silver_moon_M","@silver_moon_M","銀月マダオくん@地球大統領支持者 @silver_moon_M 型月が好きなただのマダオです。アイコンの駒鳥は堀江ありすさん( @nekomikoalice )から頂きました！","一般生徒になってキヴォトスで青春するゲーム　3 #ブルアカ","19000 ","-","20115","5664"
"itako28","@itako28","いたこ28号/北極ジロ @itako28 某秘密毛社の社員。たまに趣味の怪談で小金を稼いでます。TV番組やDVD作品や書籍やトークライブ等でなんか叫んでます。…エロエロアザラク。エロエロザメラク。たけしの超常現象マル秘Xファイルに出たことあるよっと。竹書房「憑依怪談 無縁仏」発売中　http://youtube.com/user/zzzcokeshi","3/26?10:00～ 【りゅうあツアー第4弾「箱根巡り」開催！】  箱根のパワスポ巡ろう！ なんと、スペシャルゲストとしていたこ28号さんもお越しくださいます♪ 参加費4000円(行きのロマンスカー&箱根遊覧船代込み)  ご予約はryuaofficial@yahoo.co.jpまでお願いします！","1.3万 ","2902","68","6"
"batapys1","@batapys1","違法バタピー @batapys1 そろそろ月読の準備をし、掃除もしておくか…","だってあれは初代仮面ライダーがそうだからしょうがないんじゃん…","12000 ","1318","7","7"
"kokoro_kaori358","@kokoro_kaori358","心と体を癒すセラピスト Kaori. @kokoro_kaori358 食や考え方、体に取り入れるものを変えたら人生好転体も健康にネガティブ思考→ポジティブ思考になんでもない毎日が幸せ食べたもので体はできている食べたもので心もできているいきいきと健康で幸せな毎日を過ごしていきましょう","このツイートに出会った方は  素敵な奇跡を引き寄せます","2057 ","1608","221","21"
